NombreLeccion,CanalYouTube,UrlYouTube,CursoNombre,CursoUrl,CursoId,LeccionId
Diferencias entre Centos 07 y otras distribuciones de Linux,Contando Bits,https://youtube.com/watch?v=_sxusZ6N4sk,CentOS 7,https://edutin.com/curso-de-centos-7-3841,3841,158632
Detecci贸n de versiones con Nmap,Contando Bits,https://youtube.com/watch?v=kpgsnS42WXk,Diplomado en Pentest,https://edutin.com/curso-de-pentest-4369,4369,108983
Configuraci贸n y personalizaci贸n,Council Chile,https://youtube.com/watch?v=D-TTOeCcvcw,Diplomado en Microsoft Project,https://edutin.com/curso-de-project,1920,142792
Cambiar orientaci贸n de diapositivas,CramTech,https://youtube.com/watch?v=x7SI-TXT_S8,Diplomado en Microsoft PowerPoint,https://edutin.com/curso-de-powerpoint,546,146555
Representaci贸n de n煤meros y letras con binarios,CrashCourse,https://youtube.com/watch?v=1GSjbWt0c9M,Fundamentos en Ciencias de la Computaci贸n,https://edutin.com/curso-de-introduccion-a-la-computacion-4164,4164,92891
El proceso de edici贸n en la postproducci贸n,CrashCourse,https://youtube.com/watch?v=esa0NeQI8oc,Diplomado en Producci贸n Audiovisual,https://edutin.com/curso-de-produccion-audiovisual-2081,2081,113398
La unidad central de procesamiento (CPU),CrashCourse,https://youtube.com/watch?v=FZGugFqdr60,Fundamentos en Ciencias de la Computaci贸n,https://edutin.com/curso-de-introduccion-a-la-computacion-4164,4164,92897
Puertas l贸gicas y L贸gica booleana,CrashCourse,https://youtube.com/watch?v=gI-qXk7XojA,Fundamentos en Ciencias de la Computaci贸n,https://edutin.com/curso-de-introduccion-a-la-computacion-4164,4164,92899
Memoria y Almacenamiento,CrashCourse,https://youtube.com/watch?v=TQCr9RV7twk,Fundamentos en Ciencias de la Computaci贸n,https://edutin.com/curso-de-introduccion-a-la-computacion-4164,4164,92903
Configuraci贸n c谩mara,Creativa,https://youtube.com/watch?v=J1Ve5vIaSrY,Diplomado en Fotograf铆a profesional,https://edutin.com/curso-de-fotografia-4300,4300,144723
Data management (Administraci贸n de datos),Credenciales Alternativas TEC,https://youtube.com/watch?v=OlLgrSoaT9w,Fundamentos en Ciencias de la Computaci贸n,https://edutin.com/curso-de-introduccion-a-la-computacion-4164,4164,92913
Cambiar temas y dise帽o de diapositivas,Cristian Ballesteros,https://youtube.com/watch?v=NpqxscV8ynM,Google Drive,https://edutin.com/curso-de-drive-3988,3988,141530
C贸mo dise帽ar un ventilador,Cristian Catia V5,https://youtube.com/watch?v=PkcqVADZWsE,Diplomado en Modelado con Catia,https://edutin.com/curso-de-catia-2016,2016,109984
C贸mo dise帽ar una llanta,Cristian Catia V5,https://youtube.com/watch?v=qLLhmS3aL4I,Diplomado en Modelado con Catia,https://edutin.com/curso-de-catia-2016,2016,109983
Instalaci贸n y configuraci贸n b谩sica nginx en Linux,Cumpi Linux,https://youtube.com/watch?v=fF2VZGOBWPc,Diplomado en Administraci贸n de Servidores Web con NGINX,https://edutin.com/curso-de-nginx-4087,4087,158751
La electricidad,CuriosaMente,https://youtube.com/watch?v=8mSokZu2Vf0,Fundamentos en Ciencias de la Computaci贸n,https://edutin.com/curso-de-introduccion-a-la-computacion-4164,4164,92874
"Relaci贸n de E-commerce, venta y marketing",Cyberclick  Marketing Digital,https://youtube.com/watch?v=iNcx5W_3rsM,Diplomado en CRM,https://edutin.com/curso-de-crm-2741,2741,161551
La metodolog铆a de venta inbound,Cyberclick  Marketing Digital,https://youtube.com/watch?v=jYH5MGrL9-o,Diplomado en CRM,https://edutin.com/curso-de-crm-2741,2741,107440
Hubspot y ventas,Cyberclick  Marketing Digital,https://youtube.com/watch?v=mvMHKCNRh5o,Diplomado en CRM,https://edutin.com/curso-de-crm-2741,2741,107408
"CRM de ventas en redes sociales: Whatsapp, Instagram, etc.",Cyberclick  Marketing Digital,https://youtube.com/watch?v=Q8ODalvYU2U,Diplomado en CRM,https://edutin.com/curso-de-crm-2741,2741,161543
La inteligencia artificial aplicada al marketing y ventas,Cyberclick  Marketing Digital,https://youtube.com/watch?v=qnlnwuZ4C4M,Diplomado en CRM,https://edutin.com/curso-de-crm-2741,2741,107099
Optimizar soluciones con CRM,Cyberclick  Marketing Digital,https://youtube.com/watch?v=V_YmWZioUA0,Diplomado en CRM,https://edutin.com/curso-de-crm-2741,2741,145946
Concepto de marketing digital,Cyberclick  Marketing Digital,https://youtube.com/watch?v=ZDFu_S_V_xY,Diplomado en CRM,https://edutin.com/curso-de-crm-2741,2741,145953
Unidades de almacenamiento de informaci贸n electr贸nica,Dane Hartman,https://youtube.com/watch?v=HRmfXA4EUBs,Fundamentos en Ciencias de la Computaci贸n,https://edutin.com/curso-de-introduccion-a-la-computacion-4164,4164,92901
Fundamentos de la animaci贸n,Dani Caraya,https://youtube.com/watch?v=2VwfOdirwTg,Animaci贸n y Modelado con Maya,https://edutin.com/curso-de-maya-basico-4077,4077,91250
R贸tulos,Daniel Agudelo Nore帽a,https://youtube.com/watch?v=F9WiNntznjI,Diplomado en Modelado con Catia,https://edutin.com/curso-de-catia-2016,2016,109978
Lista de elementos de un ensamble,Daniel Agudelo Nore帽a,https://youtube.com/watch?v=nsQuEMVg5JA,Diplomado en Modelado con Catia,https://edutin.com/curso-de-catia-2016,2016,109979
Herramientas de planos,Daniel Agudelo Nore帽a,https://youtube.com/watch?v=oL4bcL86gDI,Diplomado en Modelado con Catia,https://edutin.com/curso-de-catia-2016,2016,109976
C贸mo dise帽ar cuerpos s贸lidos en Catia V5,Daniel Agudelo Nore帽a,https://youtube.com/watch?v=To2V_Fnvat8,Diplomado en Modelado con Catia,https://edutin.com/curso-de-catia-2016,2016,109919
Explosionado de un ensamble,Daniel Agudelo Nore帽a,https://youtube.com/watch?v=wPlIeWw0MGM,Diplomado en Modelado con Catia,https://edutin.com/curso-de-catia-2016,2016,109986
Planos en 2D,Daniel Agudelo Nore帽a,https://youtube.com/watch?v=ZKJvpHx7RvQ,Diplomado en Modelado con Catia,https://edutin.com/curso-de-catia-2016,2016,109977
Creaci贸n y configuraci贸n de repositorios,Daniel Bautista,https://youtube.com/watch?v=XAR3p4vMnUQ,Curso de Veeam Backup & Replication,https://edutin.com/curso-de-veeam-backup-replication-3838,3838,158838
Estrategias de recuperaci贸n de desastres,Daniel Caal Archila,https://youtube.com/watch?v=l1GJ7QLxzBw,Curso de Veeam Backup & Replication,https://edutin.com/curso-de-veeam-backup-replication-3838,3838,158847
Panel de control,Daniel Fern谩ndez,https://youtube.com/watch?v=-PYEr_nK8cg,Diplomado en Sistema Operativo Windows,https://edutin.com/curso-de-windows,3581,76763
Fases y 谩reas del PMI,Danny Morales,https://youtube.com/watch?v=b4ZEFczDetY,Diplomado en Microsoft Project,https://edutin.com/curso-de-project,1920,142747
Metodolog铆a Agile,Daro,https://youtube.com/watch?v=xlmEwPHeO4k,Diplomado en Microsoft Project,https://edutin.com/curso-de-project,1920,142512
Simulaci贸n de Monte Carlo,dataminingincae,https://youtube.com/watch?v=PH6q9D8iy2E,Experto en Desarrollo de Algoritmos,https://edutin.com/curso-de-programacion-avanzada-en-c,4217,95082
Introducci贸n a Asana,David Borja,https://youtube.com/watch?v=wr9QxcqzmZc,Diplomado en Microsoft Project,https://edutin.com/curso-de-project,1920,142536
Ventajas de emplear el correo electr贸nico,David Francisco Catare Gutierrez,https://youtube.com/watch?v=IpG1fud3_wc,Diplomado en Microsoft Outlook,https://edutin.com/curso-de-outlook-1925,1925,141452
Formatos,David Garc铆a P茅rez,https://youtube.com/watch?v=G7Kc7HvPhh0,Diplomado en Fotograf铆a profesional,https://edutin.com/curso-de-fotografia-4300,4300,144729
Prepara tu c谩mara,David Lopez,https://youtube.com/watch?v=QwkT8xNxehk,Diplomado en Producci贸n Audiovisual,https://edutin.com/curso-de-produccion-audiovisual-2081,2081,104076
Uso de plataformas de nube para gestionar datos de dispositivos IoT,David Portilla - Programaci贸n y Electr贸nica,https://youtube.com/watch?v=4vD6u_dgnIQ,Fundamentos Profesionales en Redes de Computadoras,https://edutin.com/curso-de-redes-4158,4158,161148
Topograf铆a (Crear una superficie topogr谩fica por puntos),De punto y l铆nea,https://youtube.com/watch?v=CBbpJgCNXoI,Diplomado en Revit,https://edutin.com/curso-de-revit-4334,4334,104388
Muros cortina,De punto y l铆nea,https://youtube.com/watch?v=dYnpIaT_g0Y,Diplomado en Revit,https://edutin.com/curso-de-revit-4334,4334,104412
Revit 2024: Novedades y mejoras,De punto y l铆nea,https://youtube.com/watch?v=VcpPdEPx4QY,Diplomado en Revit,https://edutin.com/curso-de-revit-4334,4334,105282
M茅todos de selecci贸n,De punto y l铆nea,https://youtube.com/watch?v=x_wDdqi_n_E,Diplomado en Revit,https://edutin.com/curso-de-revit-4334,4334,104348
Opciones globales y consejos,De punto y l铆nea,https://youtube.com/watch?v=Z13pdNob1-s,Diplomado en Revit,https://edutin.com/curso-de-revit-4334,4334,104349
Composici贸n,De Viaje con la C谩mara,https://youtube.com/watch?v=4OT4vj8mvY8,Diplomado en Fotograf铆a profesional,https://edutin.com/curso-de-fotografia-4300,4300,100947
Fotograf铆a de paisaje,De Viaje con la C谩mara,https://youtube.com/watch?v=6RK4Xpi2btc,Diplomado en Fotograf铆a profesional,https://edutin.com/curso-de-fotografia-4300,4300,100971
Street photography,De Viaje con la C谩mara,https://youtube.com/watch?v=i9D5a5ukjOw,Diplomado en Fotograf铆a profesional,https://edutin.com/curso-de-fotografia-4300,4300,100970
Configuraci贸n y manejo de identidades y accesos,Debuggers,https://youtube.com/watch?v=_du5S4YkciQ,Google Kubernetes Engine,https://edutin.com/curso-de-google-kubernetes-engine,12435,164547
Introducci贸n al autoescalado en GKE,Debuggers,https://youtube.com/watch?v=-gZHbbVGQxo,Google Kubernetes Engine,https://edutin.com/curso-de-google-kubernetes-engine,12435,164559
Conceptos b谩sicos de Google Cloud SQL,Debuggers,https://youtube.com/watch?v=3uttnNG0mCA,Google Cloud Platform,https://edutin.com/curso-de-google-cloud-platform-gcp,12460,164801
Despliegue continuo en Google Cloud Platform,Debuggers,https://youtube.com/watch?v=4s0t3Xjzi_A,Google Cloud Platform,https://edutin.com/curso-de-google-cloud-platform-gcp,12460,164796
Conceptos b谩sicos de los autoescalado,Debuggers,https://youtube.com/watch?v=79WcXhTPTik,Google Kubernetes Engine,https://edutin.com/curso-de-google-kubernetes-engine,12435,164560
Cloud build y cloud run como herramientas para la automatizaci贸n de CI/CD y despliegues serverless,Debuggers,https://youtube.com/watch?v=CepwyqMD0UY,Google Kubernetes Engine,https://edutin.com/curso-de-google-kubernetes-engine,12435,164540
Ejemplo pr谩ctico de pub/sub,Debuggers,https://youtube.com/watch?v=clBYjU5QsVI,Google Cloud Platform,https://edutin.com/curso-de-google-cloud-platform-gcp,12460,164800
Google kubernetes engine en Google Cloud Platform,Debuggers,https://youtube.com/watch?v=cvr58LOUwGE,Google Cloud Platform,https://edutin.com/curso-de-google-cloud-platform-gcp,12460,164797
Ejercicio pr谩ctico de cloud storage,Debuggers,https://youtube.com/watch?v=dZkKfgO0z1o,Google Cloud Platform,https://edutin.com/curso-de-google-cloud-platform-gcp,12460,164806
Funcionamiento del plano de control en kubernetes,Debuggers,https://youtube.com/watch?v=e6hXhj9e7qM,Google Kubernetes Engine,https://edutin.com/curso-de-google-kubernetes-engine,12435,164542
API de kubernetes,Debuggers,https://youtube.com/watch?v=g0qye-OKqZQ,Google Kubernetes Engine,https://edutin.com/curso-de-google-kubernetes-engine,12435,164543
Qu茅 es google compute engine,Debuggers,https://youtube.com/watch?v=g53OrQ2_sm0,Google Cloud Platform,https://edutin.com/curso-de-google-cloud-platform-gcp,12460,164792
Google Cloud storage,Debuggers,https://youtube.com/watch?v=GLd_FlxtbSw,Google Cloud Platform,https://edutin.com/curso-de-google-cloud-platform-gcp,12460,164805
Introducci贸n a spinnaker para CI/CD en kubernetes,Debuggers,https://youtube.com/watch?v=GxjuadtQSm0,Google Kubernetes Engine,https://edutin.com/curso-de-google-kubernetes-engine,12435,164546
Creaci贸n de un repositorio,Debuggers,https://youtube.com/watch?v=h3QUSxyKb_U,Google Cloud Platform,https://edutin.com/curso-de-google-cloud-platform-gcp,12460,164795
Ejemplo pr谩ctico de google kubernetes engine,Debuggers,https://youtube.com/watch?v=heLmwxL3q4o,Google Cloud Platform,https://edutin.com/curso-de-google-cloud-platform-gcp,12460,164793
Creaci贸n de un cluster,Debuggers,https://youtube.com/watch?v=HvODiWqC6J8,Google Cloud Platform,https://edutin.com/curso-de-google-cloud-platform-gcp,12460,164798
Cloud build kubernetes,Debuggers,https://youtube.com/watch?v=HvODiWqC6J8,Google Cloud Platform,https://edutin.com/curso-de-google-cloud-platform-gcp,12460,164799
Google Cloud bigquery,Debuggers,https://youtube.com/watch?v=kqdVy8gaJgQ,Google Cloud Platform,https://edutin.com/curso-de-google-cloud-platform-gcp,12460,164803
Instalaci贸n avanzada de helm en GCP,Debuggers,https://youtube.com/watch?v=LBElsLIphI4,Google Kubernetes Engine,https://edutin.com/curso-de-google-kubernetes-engine,12435,164557
Ejercicio pr谩ctico II: Google Cloud VPC,Debuggers,https://youtube.com/watch?v=LeQ1XePTAiA,Google Cloud Platform,https://edutin.com/curso-de-google-cloud-platform-gcp,12460,164811
Configuraci贸n de google pub/sub para eventos en tiempo real,Debuggers,https://youtube.com/watch?v=M5bJ2zaryM4,Google Kubernetes Engine,https://edutin.com/curso-de-google-kubernetes-engine,12435,164548
Implementaci贸n de cloud build y cloud run,Debuggers,https://youtube.com/watch?v=nEezGlhWees,Google Kubernetes Engine,https://edutin.com/curso-de-google-kubernetes-engine,12435,164541
Autoescalado de archivos YAML,Debuggers,https://youtube.com/watch?v=NKunwJpkrsU,Google Kubernetes Engine,https://edutin.com/curso-de-google-kubernetes-engine,12435,164561
Ejercicio pr谩ctico de Google DNS,Debuggers,https://youtube.com/watch?v=p6MvCpW2Ngg,Google Cloud Platform,https://edutin.com/curso-de-google-cloud-platform-gcp,12460,164814
Qu茅 es helm,Debuggers,https://youtube.com/watch?v=qCLgKy23BOY,Google Kubernetes Engine,https://edutin.com/curso-de-google-kubernetes-engine,12435,164550
Ejercicio pr谩ctico III: Google Cloud VPC,Debuggers,https://youtube.com/watch?v=QEA9Bix_rfc,Google Cloud Platform,https://edutin.com/curso-de-google-cloud-platform-gcp,12460,164812
Configuraci贸n de proyecto bigquery,Debuggers,https://youtube.com/watch?v=Qr_P1AD91cE,Google Cloud Platform,https://edutin.com/curso-de-google-cloud-platform-gcp,12460,164804
Implementaci贸n de spinnaker usando helm y su configuraci贸n en google cloud,Debuggers,https://youtube.com/watch?v=qsinEU1Zqtw,Google Kubernetes Engine,https://edutin.com/curso-de-google-kubernetes-engine,12435,164549
Pr谩ctica y configuraci贸n cloud bigtable,Debuggers,https://youtube.com/watch?v=r8YhcZM9R4Q,Google Cloud Platform,https://edutin.com/curso-de-google-cloud-platform-gcp,12460,164808
Implementaci贸n de jenkins en GCP,Debuggers,https://youtube.com/watch?v=rcQqKWvu3q8,Google Kubernetes Engine,https://edutin.com/curso-de-google-kubernetes-engine,12435,164555
Configuraci贸n de pipelines en spinnaker,Debuggers,https://youtube.com/watch?v=Rn4QL35VXsU,Google Kubernetes Engine,https://edutin.com/curso-de-google-kubernetes-engine,12435,164553
Escalado de clusters,Debuggers,https://youtube.com/watch?v=sb4JBLjgghw,Google Kubernetes Engine,https://edutin.com/curso-de-google-kubernetes-engine,12435,164563
Cloud bigtable,Debuggers,https://youtube.com/watch?v=sXhk9C2vm2I,Google Cloud Platform,https://edutin.com/curso-de-google-cloud-platform-gcp,12460,164807
Configuraci贸n profunda de pipelines en GKE,Debuggers,https://youtube.com/watch?v=U7_sf5sA0S0,Google Kubernetes Engine,https://edutin.com/curso-de-google-kubernetes-engine,12435,164558
Historia y evoluci贸n de la tecnolog铆a,Debuggers,https://youtube.com/watch?v=V56ubeoTqzo,Google Cloud Platform,https://edutin.com/curso-de-google-cloud-platform-gcp,12460,164791
Autoaprovisionamiento pr谩ctico,Debuggers,https://youtube.com/watch?v=vf9L0PYIfSE,Google Kubernetes Engine,https://edutin.com/curso-de-google-kubernetes-engine,12435,164564
Preparaci贸n de archivos manifest en spinnaker,Debuggers,https://youtube.com/watch?v=vpSPEaZVRmw,Google Kubernetes Engine,https://edutin.com/curso-de-google-kubernetes-engine,12435,164552
Ejercicio pr谩ctico I: Google Cloud VPC,Debuggers,https://youtube.com/watch?v=Wg_OkrTMOaE,Google Cloud Platform,https://edutin.com/curso-de-google-cloud-platform-gcp,12460,164810
Google Cloud DNS,Debuggers,https://youtube.com/watch?v=wm56aJP9eCg,Google Cloud Platform,https://edutin.com/curso-de-google-cloud-platform-gcp,12460,164813
Jenkins en GCP,Debuggers,https://youtube.com/watch?v=xGKWaAyvJ1E,Google Kubernetes Engine,https://edutin.com/curso-de-google-kubernetes-engine,12435,164554
Google Cloud VPC,Debuggers,https://youtube.com/watch?v=ypC0tQBFDME,Google Cloud Platform,https://edutin.com/curso-de-google-cloud-platform-gcp,12460,164809
Ejemplo pr谩ctico generaci贸n de un contenedor a trav茅s de docker,Debuggers,https://youtube.com/watch?v=yuaX52TLt1o,Google Cloud Platform,https://edutin.com/curso-de-google-cloud-platform-gcp,12460,164794
Generaci贸n de im谩genes en docker para kubernetes,Debuggers,https://youtube.com/watch?v=YXezTdc7SNY,Google Kubernetes Engine,https://edutin.com/curso-de-google-kubernetes-engine,12435,164551
Manejo pr谩ctico de Google Cloud SQL,Debuggers,https://youtube.com/watch?v=z_BsAKLU1Nw,Google Cloud Platform,https://edutin.com/curso-de-google-cloud-platform-gcp,12460,164802
Ejercicio pr谩ctico: auto escalado horizontal en GCP,Debuggers,https://youtube.com/watch?v=Z2oKar0F2XI,Google Kubernetes Engine,https://edutin.com/curso-de-google-kubernetes-engine,12435,164562
Creaci贸n de cluster jenkins en GCP,Debuggers,https://youtube.com/watch?v=zwEeU6YoxwQ,Google Kubernetes Engine,https://edutin.com/curso-de-google-kubernetes-engine,12435,164556
Unicast Globales,DeciLearn,https://youtube.com/watch?v=l-p3FIfRLsc,Fundamentos Profesionales en Redes de Computadoras,https://edutin.com/curso-de-redes-4158,4158,93899
Conceptos de la resoluci贸n,Denis Veprev,https://youtube.com/watch?v=HZY22SG4uMk,Diplomado en Producci贸n Audiovisual,https://edutin.com/curso-de-produccion-audiovisual-2081,2081,104073
Protecci贸n de la cuenta,Descubre C贸mo Hacerlo,https://youtube.com/watch?v=F-b2FTGVVfA,Google Drive,https://edutin.com/curso-de-drive-3988,3988,141471
Arquitectura de los Metasploit,DevGuardian Code,https://youtube.com/watch?v=AAE3MYAGiJI,Diplomado en Pentest,https://edutin.com/curso-de-pentest-4369,4369,109033
Descargar e instalar Visual Studio,DeVito,https://youtube.com/watch?v=QTFgr3TF_IY,Desarrollador PHP,https://edutin.com/curso-de-php,4495,157300
Puertos,dfbastidas,https://youtube.com/watch?v=mujGV_oyr3A,Docker Profesional,https://edutin.com/curso-de-docker-3986,3986,152220
Dise帽o del Data Center,Diego Teos,https://youtube.com/watch?v=oo7KBnfAPq0,Fundamentos Profesionales en Redes de Computadoras,https://edutin.com/curso-de-redes-4158,4158,93876
Instalaci贸n de NGINX en Fedora,DigitalEducas,https://youtube.com/watch?v=corVHKkxtcY,Diplomado en Administraci贸n de Servidores Web con NGINX,https://edutin.com/curso-de-nginx-4087,4087,158749
Portapapeles en Power Point,DiloenTutos Pc,https://youtube.com/watch?v=0g1L2rP2haA,Diplomado en Microsoft PowerPoint,https://edutin.com/curso-de-powerpoint,546,146530
Convertir PDF a video,DiloenTutos Pc,https://youtube.com/watch?v=oDGZmS3-vZc,Diplomado en Microsoft PowerPoint,https://edutin.com/curso-de-powerpoint,546,106268
"Plantas, secciones y m谩s",DIMANI,https://youtube.com/watch?v=Bgv2bR6bxC0,Diplomado en Revit,https://edutin.com/curso-de-revit-4334,4334,104317
Suelos y Muros,DIMANI,https://youtube.com/watch?v=BOlTzGm7C8E,Diplomado en Revit,https://edutin.com/curso-de-revit-4334,4334,104310
Gradas y losa,DIMANI,https://youtube.com/watch?v=CcJ_0FSFu0c,Diplomado en Revit,https://edutin.com/curso-de-revit-4334,4334,104314
Profundizaci贸n en materiales y superficies,DIMANI,https://youtube.com/watch?v=IOcFvI-MiNA,Diplomado en Revit,https://edutin.com/curso-de-revit-4334,4334,104312
Configuraci贸n de muros,DIMANI,https://youtube.com/watch?v=Q1jdhqQO6og,Diplomado en Revit,https://edutin.com/curso-de-revit-4334,4334,104316
Insertar y personalizar tablas,Diplomado AVA UES-FMO,https://youtube.com/watch?v=URBG0zWFFZc,Google Drive,https://edutin.com/curso-de-drive-3988,3988,141527
Or铆genes y evoluci贸n de la comunicaci贸n humana,Direcci贸n de Educaci贸n en L铆nea,https://youtube.com/watch?v=LTP2_xKEPm8,Fundamentos en Ciencias de la Computaci贸n,https://edutin.com/curso-de-introduccion-a-la-computacion-4164,4164,92881
Tips para la realizaci贸n de diapositivas,Dise帽o Radical,https://youtube.com/watch?v=3Xbm5e1lmxc,Diplomado en Microsoft PowerPoint,https://edutin.com/curso-de-powerpoint,546,106192
Dise帽o de VLANs y direccionamiento IP,DOC Henriquez Celedon Javier Alfonso,https://youtube.com/watch?v=lio07jHfkp0,Fundamentos Profesionales en Redes de Computadoras,https://edutin.com/curso-de-redes-4158,4158,93877
Cambios en la interfaz de Scratch 3.0 VS Scratch 2.0,Docente Pro,https://youtube.com/watch?v=0_ZqyKaXLPw,Desarrollador de Algoritmos,https://edutin.com/curso-de-programacion-c,4163,111484
Configurar correos masivos,Don Franz,https://youtube.com/watch?v=NXU95ZoCAz4,Diplomado en Microsoft Outlook,https://edutin.com/curso-de-outlook-1925,1925,141690
Uso de f贸rmulas,Dostin Hurtado,https://youtube.com/watch?v=ROHPnUbSBfk,Google Drive,https://edutin.com/curso-de-drive-3988,3988,141548
C贸mo guardar y/o exportar,Dostin Hurtado,https://youtube.com/watch?v=uHFu9k5OVlM,Editor de Gr谩ficos Vectoriales con Adobe Illustrator,https://edutin.com/curso-de-illustrator-3738,3738,111170
Exportar para imprimir y pantallas,Dostin Hurtado,https://youtube.com/watch?v=uHFu9k5OVlM,Editor de Gr谩ficos Vectoriales con Adobe Illustrator,https://edutin.com/curso-de-illustrator-3738,3738,111338
Habilitar virtualizaci贸n de Windows,Dr Tutoriales,https://youtube.com/watch?v=NIgw0yEVewE,Diplomado en Virtualizaci贸n con Hyper-V,https://edutin.com/curso-de-hyper-v-3839,3839,153278
Pasos para implementar el DF,Dr. Mart铆n Llamas,https://youtube.com/watch?v=5n9MM2jFL84,Diplomado en Windows Server,https://edutin.com/curso-de-windows-server,4485,148271
La post-producci贸n,Dream Engine,https://youtube.com/watch?v=bUm2wbFkS2s,Diplomado en Producci贸n Audiovisual,https://edutin.com/curso-de-produccion-audiovisual-2081,2081,113397
Conociendo la interfaz de Revit 2024,DS Design - BIM Learning,https://youtube.com/watch?v=3T81yYNE4tU,Diplomado en Revit,https://edutin.com/curso-de-revit-4334,4334,104268
Explicaci贸n a profundidad sobre BIM,DS Design - BIM Learning,https://youtube.com/watch?v=W7-IePBoxQc,Diplomado en Revit,https://edutin.com/curso-de-revit-4334,4334,104307
Explicaci贸n a profundidad sobre BIM,DS Design - BIM Learning,https://youtube.com/watch?v=W7-IePBoxQc,Diplomado en ArchiCAD,https://edutin.com/curso-de-archicad-4346,4346,105390
Optimizaci贸n de recursos para un mejor rendimiento en la nube,Dumar A Yustre,https://youtube.com/watch?v=ASoon5actT8,VMware Workstation,https://edutin.com/curso-de-vmware-workstation-3835,3835,159091
Filtros (Electricidad),Dwisest,https://youtube.com/watch?v=0RbqcMpMA4U,Diplomado en Revit,https://edutin.com/curso-de-revit-4334,4334,104518
Crear aparatos sanitarios (Fontaneria),Dwisest,https://youtube.com/watch?v=0RhsLYKP0k4,Diplomado en Revit,https://edutin.com/curso-de-revit-4334,4334,104487
Crear isometr铆a (Fontaner铆a),Dwisest,https://youtube.com/watch?v=1ksQtmIRQ2E,Diplomado en Revit,https://edutin.com/curso-de-revit-4334,4334,104507
Introducci贸n a Revit MEP y Plantilla de trabajo (Fontaner铆a),Dwisest,https://youtube.com/watch?v=2HVHqLSHbOA,Diplomado en Revit,https://edutin.com/curso-de-revit-4334,4334,104481
Planos y l谩minas (Electricidad),Dwisest,https://youtube.com/watch?v=2YARMhs-n1s,Diplomado en Revit,https://edutin.com/curso-de-revit-4334,4334,104521
Colocar tomas e interruptores (Electricidad),Dwisest,https://youtube.com/watch?v=5ILb_YLfDF0,Diplomado en Revit,https://edutin.com/curso-de-revit-4334,4334,104513
Despiece o armadura de zapatas,Dwisest,https://youtube.com/watch?v=6L8Ut4uP0gA,Diplomado en Revit,https://edutin.com/curso-de-revit-4334,4334,104609
Crear y editar zapatas,Dwisest,https://youtube.com/watch?v=7iaBFYxqnQE,Diplomado en Revit,https://edutin.com/curso-de-revit-4334,4334,104605
Tuber铆a hidr谩ulica (Fontaner铆a),Dwisest,https://youtube.com/watch?v=B-7Bfsz8tY0,Diplomado en Revit,https://edutin.com/curso-de-revit-4334,4334,104489
Colocar luminarias (Electricidad),Dwisest,https://youtube.com/watch?v=c0eHRWybxrM,Diplomado en Revit,https://edutin.com/curso-de-revit-4334,4334,104512
Crear ejes estructurales,Dwisest,https://youtube.com/watch?v=c2kL1czNCy8,Diplomado en Revit,https://edutin.com/curso-de-revit-4334,4334,104603
Di谩metro y propiedades (Fontaner铆a),Dwisest,https://youtube.com/watch?v=C5Xc_Czfwi8,Diplomado en Revit,https://edutin.com/curso-de-revit-4334,4334,104484
Crear componentes y conexiones (Fontaner铆a),Dwisest,https://youtube.com/watch?v=DlULAu24j5E,Diplomado en Revit,https://edutin.com/curso-de-revit-4334,4334,104486
Maya 2016 - Copiar y Duplicar - Tutorial B谩sico 12 - En Espa帽ol,Dwisest,https://youtube.com/watch?v=dMO4jMKklP8,Animaci贸n y Modelado con Maya,https://edutin.com/curso-de-maya-basico-4077,4077,91238
Despiece o armadura de columnas,Dwisest,https://youtube.com/watch?v=esMLnX7t300,Diplomado en Revit,https://edutin.com/curso-de-revit-4334,4334,104611
V谩lvulas y accesorios (Fontaner铆a),Dwisest,https://youtube.com/watch?v=f2GYE9QMXUM,Diplomado en Revit,https://edutin.com/curso-de-revit-4334,4334,104494
L谩minas o planos,Dwisest,https://youtube.com/watch?v=fFLai0kkcTE,Diplomado en Revit,https://edutin.com/curso-de-revit-4334,4334,104616
Tuber铆a sanitaria (Fontaner铆a),Dwisest,https://youtube.com/watch?v=fxPhBwXmvzA,Diplomado en Revit,https://edutin.com/curso-de-revit-4334,4334,104501
Cantidades (Electricidad),Dwisest,https://youtube.com/watch?v=GG8Gfs7gnhE,Diplomado en Revit,https://edutin.com/curso-de-revit-4334,4334,104520
Crear tubos (Electricidad),Dwisest,https://youtube.com/watch?v=h6tFoM95YmU,Diplomado en Revit,https://edutin.com/curso-de-revit-4334,4334,104517
