NombreLeccion,CanalYouTube,UrlYouTube,CursoNombre,CursoUrl,CursoId,LeccionId
Herramienta de Gesti贸n de Proyectos,@ffbonta,https://youtube.com/watch?v=IbcmLarVdSA,Diplomado en Microsoft Project,https://edutin.com/curso-de-project,1920,142522
Uso de la I.A para el desarrollo de presentaciones en PowerPoint, SALVAJE ,https://youtube.com/watch?v=xZzs7NQyMOI,Diplomado en Microsoft PowerPoint,https://edutin.com/curso-de-powerpoint,546,161393
Concepto de 3D,3D Basics,https://youtube.com/watch?v=9DdzxVcLRwY,Animaci贸n y Modelado con Maya,https://edutin.com/curso-de-maya-basico-4077,4077,91232
Ribbon y la barra de acceso r谩pido (QAT),3d4every1,https://youtube.com/watch?v=FgnQhtSZi0w,Diplomado en Revit,https://edutin.com/curso-de-revit-4334,4334,104328
Steering Wheel,3d4every1,https://youtube.com/watch?v=FH91QUABrik,Diplomado en Revit,https://edutin.com/curso-de-revit-4334,4334,104344
Entendiendo las jerarqu铆as de los elementos,3d4every1,https://youtube.com/watch?v=hFc3V3hOhaI,Diplomado en Revit,https://edutin.com/curso-de-revit-4334,4334,104323
Modificadores I,3DISEC,https://youtube.com/watch?v=1X2DReVE0k0,Diplomado en Revit,https://edutin.com/curso-de-revit-4334,4334,104437
Modificadores II,3DISEC,https://youtube.com/watch?v=dzkcvG1qIk0,Diplomado en Revit,https://edutin.com/curso-de-revit-4334,4334,113587
Configuraci贸n de las reglas e interfaz de Outlook,A un paso de la ciencia,https://youtube.com/watch?v=PTeoCPfMaIw,Diplomado en Microsoft Outlook,https://edutin.com/curso-de-outlook-1925,1925,141642
Configuraci贸n de la cantidad de workers,Abdulrhman Gamal,https://youtube.com/watch?v=eBd4HjCwtBk,Diplomado en Administraci贸n de Servidores Web con NGINX,https://edutin.com/curso-de-nginx-4087,4087,91482
Configuraci贸n de permisos y propietarios de archivos,Abilia VG,https://youtube.com/watch?v=PeEbUup7iFw,CentOS 7,https://edutin.com/curso-de-centos-7-3841,3841,158659
Diferencias entre programar y planificar un proyecto,Academia Control de Proyectos,https://youtube.com/watch?v=zlzgtykC1x4,Diplomado en Microsoft Project,https://edutin.com/curso-de-project,1920,142589
Compartir link,Academia G - Tutoriales Google Workspace,https://youtube.com/watch?v=s5ygUxxcg6s,Google Drive,https://edutin.com/curso-de-drive-3988,3988,141493
"Conceptos, tipolog铆a, funciones y clasificaciones de los proyectos",ACEDES Desarrollo Social y Econ贸mico,https://youtube.com/watch?v=MltNXoX_v0E,Diplomado en Microsoft Project,https://edutin.com/curso-de-project,1920,142478
C贸mo idear proyectos creativos,Activa tus ideas,https://youtube.com/watch?v=XSE6goX9NNY,Animaci贸n y Modelado con Maya,https://edutin.com/curso-de-maya-basico-4077,4077,147343
Concepto de gr谩ficos vectoriales,Adriana Gastaldi,https://youtube.com/watch?v=iVjkfmzfmvo,Editor de Gr谩ficos Vectoriales con Adobe Illustrator,https://edutin.com/curso-de-illustrator-3738,3738,111152
Fotos en manual,Ainara Garcia,https://youtube.com/watch?v=QSO0hVTutWw,Diplomado en Fotograf铆a profesional,https://edutin.com/curso-de-fotografia-4300,4300,100976
Concepto de fragmentaci贸n,AirXander,https://youtube.com/watch?v=_vYqiNshmj0,Diplomado en Sistema Operativo Windows,https://edutin.com/curso-de-windows,3581,76746
Configuraci贸n de NAT en routers,Alan Yair Solano Cuevas,https://youtube.com/watch?v=SNhNpw-sPmA,fundamentos de cisco packet tracer,https://edutin.com/curso-de-Cisco-Packet-Tracer,571,163387
Verificaci贸n y soluci贸n de problemas en tabla de enrutamiento,Albert redes,https://youtube.com/watch?v=voZt9ZZB44U,fundamentos de cisco packet tracer,https://edutin.com/curso-de-Cisco-Packet-Tracer,571,163375
Relaci贸n de CRM y gesti贸n de proyectos,Alberto V谩zquez,https://youtube.com/watch?v=nLdVOXsbOuI,Diplomado en CRM,https://edutin.com/curso-de-crm-2741,2741,145964
Access Points:  Tipos y estados,AlbertoLopez TECH TIPS,https://youtube.com/watch?v=aD2_VK9bptQ,Fundamentos Profesionales en Redes de Computadoras,https://edutin.com/curso-de-redes-4158,4158,93871
Concepto de im谩gen,AlbertoLopez TECH TIPS,https://youtube.com/watch?v=FAJ1o3hb35s,Docker Profesional,https://edutin.com/curso-de-docker-3986,3986,112333
Importancia de las herramientas en la gesti贸n de proyectos,Aleja Melo,https://youtube.com/watch?v=8TLQPj7sngc,Diplomado en Microsoft Project,https://edutin.com/curso-de-project,1920,142523
Utilizaci贸n de las puertas y ventanas,Alejandra Baca,https://youtube.com/watch?v=vqd1WV1vzcg,Diplomado en Revit,https://edutin.com/curso-de-revit-4334,4334,104311
Instalaci贸n de ArchiCAD,Alex DM Estudio,https://youtube.com/watch?v=EwtQjTtMqtc,Diplomado en ArchiCAD,https://edutin.com/curso-de-archicad-4346,4346,105811
Montaje en la postproducci贸n (Cortes y transiciones),Alex S.M.,https://youtube.com/watch?v=YHH-BmXpQ6k,Diplomado en Producci贸n Audiovisual,https://edutin.com/curso-de-produccion-audiovisual-2081,2081,113400
T茅cnicas b谩sicas de escaneo con Nmap,Alexander Tutoriales,https://youtube.com/watch?v=m_0E6aBeuQU,Diplomado en Pentest,https://edutin.com/curso-de-pentest-4369,4369,108971
Crear personaje Flat design,AlexDG Tutoriales,https://youtube.com/watch?v=3gBSFOKY1Hs,Editor de Gr谩ficos Vectoriales con Adobe Illustrator,https://edutin.com/curso-de-illustrator-3738,3738,111355
Adaptar texto a una forma,AlexDG Tutoriales,https://youtube.com/watch?v=sxxBUiRshAY,Editor de Gr谩ficos Vectoriales con Adobe Illustrator,https://edutin.com/curso-de-illustrator-3738,3738,111281
Introducci贸n a la interfaz,Altatec Seguridad,https://youtube.com/watch?v=3N3e3wC1-pg,fundamentos de cisco packet tracer,https://edutin.com/curso-de-Cisco-Packet-Tracer,571,140979
IPV4,Altatec Seguridad,https://youtube.com/watch?v=Ao0GAXJx7oU,fundamentos de cisco packet tracer,https://edutin.com/curso-de-Cisco-Packet-Tracer,571,141050
Asignaci贸n de direcciones ip y configuraci贸n,Altatec Seguridad,https://youtube.com/watch?v=Ao0GAXJx7oU,fundamentos de cisco packet tracer,https://edutin.com/curso-de-Cisco-Packet-Tracer,571,163372
Servidor DHCP,Altatec Seguridad,https://youtube.com/watch?v=JA1suf3o_Bw,fundamentos de cisco packet tracer,https://edutin.com/curso-de-Cisco-Packet-Tracer,571,141032
Formas de Detectar intrusos en Windows,Alvaro Chirou,https://youtube.com/watch?v=DM5bzxNTCks,Diplomado en Sistema Operativo Windows,https://edutin.com/curso-de-windows,3581,147223
Distorsionar con envolvente,Alx Marroqu铆n,https://youtube.com/watch?v=LgXWTurQKEU,Editor de Gr谩ficos Vectoriales con Adobe Illustrator,https://edutin.com/curso-de-illustrator-3738,3738,111334
Vectorizar dibujo hecho a mano,Alx Marroqu铆n,https://youtube.com/watch?v=LSE-wwAGKOE,Editor de Gr谩ficos Vectoriales con Adobe Illustrator,https://edutin.com/curso-de-illustrator-3738,3738,111253
Colorear dibujo hecho a mano,Alx Marroqu铆n,https://youtube.com/watch?v=SpalZ2HfTmY,Editor de Gr谩ficos Vectoriales con Adobe Illustrator,https://edutin.com/curso-de-illustrator-3738,3738,111254
Ventajas de usar VMware Workstation en la nube,Amazon Web Services Latin America,https://youtube.com/watch?v=oy__tBpZHHI,VMware Workstation,https://edutin.com/curso-de-vmware-workstation-3835,3835,159074
Importancia de metodolog铆as para el desarrollo de proyectos,Andrea Gutierrez,https://youtube.com/watch?v=TEO7N_750qI,Diplomado en Microsoft Project,https://edutin.com/curso-de-project,1920,142504
Estilos de modelado 3D,Andres Cebrian,https://youtube.com/watch?v=bpsBi_9K94A,Animaci贸n y Modelado con Maya,https://edutin.com/curso-de-maya-basico-4077,4077,91244
Principios para crecer en el 3D,Andres Cebrian,https://youtube.com/watch?v=xoJjnRCaPyc,Animaci贸n y Modelado con Maya,https://edutin.com/curso-de-maya-basico-4077,4077,91245
Proceso de instalaci贸n paso a paso,Andres Mora,https://youtube.com/watch?v=rQFcE67BbaY,Zentyal,https://edutin.com/curso-de-zentyal-3840,3840,159233
Degradados,Andr茅s R铆os M.,https://youtube.com/watch?v=UKL9_pU4yv8,Editor de Gr谩ficos Vectoriales con Adobe Illustrator,https://edutin.com/curso-de-illustrator-3738,3738,111264
Desfragmentar disco duro,Angel PC Tutoriales,https://youtube.com/watch?v=ZjVx_cGrlLQ,Diplomado en Sistema Operativo Windows,https://edutin.com/curso-de-windows,3581,76762
Tipos de sistemas operativos,Angel Pimienta,https://youtube.com/watch?v=H9rmglUXsnE,Diplomado en Sistema Operativo Windows,https://edutin.com/curso-de-windows,3581,147136
Exportar animaci贸n,Animacion 3D,https://youtube.com/watch?v=sIetoWdpfIU,Animaci贸n y Modelado con Maya,https://edutin.com/curso-de-maya-basico-4077,4077,147339
Introducci贸n a la animaci贸n,ANIMATRPOLIS,https://youtube.com/watch?v=5MY3kY9ce9o,Animaci贸n y Modelado con Maya,https://edutin.com/curso-de-maya-basico-4077,4077,91248
T茅cnicas de la animaci贸n,ANIMATRPOLIS,https://youtube.com/watch?v=J9R7hBRzyYI,Animaci贸n y Modelado con Maya,https://edutin.com/curso-de-maya-basico-4077,4077,91252
Conceptos del pixel,Anteldetodos,https://youtube.com/watch?v=Aeu-f9Ye0tQ,Diplomado en Producci贸n Audiovisual,https://edutin.com/curso-de-produccion-audiovisual-2081,2081,104072
Filtrado y seguridad,Antonio de Andr茅s Lema,https://youtube.com/watch?v=kESyHFFoX-E,Zentyal,https://edutin.com/curso-de-zentyal-3840,3840,159255
Asignaci贸n de direcciones IP,Antonio de Andr茅s Lema,https://youtube.com/watch?v=oiQjqe9_618,Zentyal,https://edutin.com/curso-de-zentyal-3840,3840,159244
Introducci贸n a la simulaci贸n,Antonio Hoyos Chaverra,https://youtube.com/watch?v=WcWEXC8bmag,Experto en Desarrollo de Algoritmos,https://edutin.com/curso-de-programacion-avanzada-en-c,4217,95081
Direcci贸n local 煤nica,Antonio Villarroel,https://youtube.com/watch?v=5Tu7HUoI43s,Fundamentos Profesionales en Redes de Computadoras,https://edutin.com/curso-de-redes-4158,4158,93901
Representaci贸n hexadecimal,Antonio Villarroel,https://youtube.com/watch?v=dfX89veZtwk,Fundamentos Profesionales en Redes de Computadoras,https://edutin.com/curso-de-redes-4158,4158,93897
Unicast deEnlace local (link-local),Antonio Villarroel,https://youtube.com/watch?v=XtdRu_I_5lg,Fundamentos Profesionales en Redes de Computadoras,https://edutin.com/curso-de-redes-4158,4158,93900
Concepto de LEAD,ANUOR AGUILAR,https://youtube.com/watch?v=C_UwctqOxLg,Diplomado en CRM,https://edutin.com/curso-de-crm-2741,2741,107144
Crear gr谩ficos animados,Aplus Class,https://youtube.com/watch?v=vy9c1K2-ci8,Diplomado en Microsoft PowerPoint,https://edutin.com/curso-de-powerpoint,546,146543
Tipos de datos,APM 2017,https://youtube.com/watch?v=hIaWrkmW4BU,Google Drive,https://edutin.com/curso-de-drive-3988,3988,141544
F贸rmula BANT,Apps Implantadores,https://youtube.com/watch?v=IdAEElK5hhA,Diplomado en CRM,https://edutin.com/curso-de-crm-2741,2741,107181
Creaci贸n de gr谩ficos estad铆sticos,Aprende Algo M谩s,https://youtube.com/watch?v=Dq7N72n32Ms,Diplomado en Microsoft PowerPoint,https://edutin.com/curso-de-powerpoint,546,146573
Personalizar tama帽o de diapositivas,Aprende Con Ander,https://youtube.com/watch?v=IjXrMPBGqzc,Diplomado en Microsoft PowerPoint,https://edutin.com/curso-de-powerpoint,546,146553
Filtrar datos,Aprende Excel,https://youtube.com/watch?v=7UTG5PVi46k,Diplomado en Microsoft Excel - Enfoque Contabilidad y Finanzas,https://edutin.com/curso-de-excel-para-contadores,4499,149259
Herramientas de Microsoft Office 365,Aprendeman铆a,https://youtube.com/watch?v=eQPODhV9W98,Diplomado en Microsoft PowerPoint,https://edutin.com/curso-de-powerpoint,546,146441
Google Drive,Aprender A,https://youtube.com/watch?v=qE8yX0ovkq8,Google Drive,https://edutin.com/curso-de-drive-3988,3988,141464
Comandos b谩sicos de Docker,Aprender Big Data,https://youtube.com/watch?v=kjnPTx1Ud0Q,Docker Profesional,https://edutin.com/curso-de-docker-3986,3986,112261
Compartir y edici贸n en grupo,Aprender Gratis,https://youtube.com/watch?v=W2Msm1e90-s,Google Drive,https://edutin.com/curso-de-drive-3988,3988,141534
Aprendizaje profundo,Aprendizaje Profundo,https://youtube.com/watch?v=jXu0RC6D-rQ,Diplomado en Fundamentos de la Inteligencia Artificial,https://edutin.com/curso-de-introduccion-a-la-inteligencia-artificial-4243,4243,96627
Organizaci贸n del correo,APTeck Tutorials,https://youtube.com/watch?v=GSSRoGUC0Nk,Diplomado en Microsoft Outlook,https://edutin.com/curso-de-outlook-1925,1925,141657
Fragmentaci贸n y reensamblaje,AR2 Flipped,https://youtube.com/watch?v=6czsiIKsZUg,IPv6 Profesional,https://edutin.com/curso-de-ipv6-3548,3548,143292
Paquetes IPV4,AR2 Flipped,https://youtube.com/watch?v=AGVLFjdOU5I,IPv6 Profesional,https://edutin.com/curso-de-ipv6-3548,3548,143296
La cabecera del datagrama IPv4,AR2 Flipped,https://youtube.com/watch?v=AGVLFjdOU5I,Fundamentos Profesionales en Redes de Computadoras,https://edutin.com/curso-de-redes-4158,4158,93882
Las direcciones IPV4,AR2 Flipped,https://youtube.com/watch?v=exOFEVAOI88,IPv6 Profesional,https://edutin.com/curso-de-ipv6-3548,3548,143290
Los m贸dulos de la red,ARC UV,https://youtube.com/watch?v=l007fkbVXXc,Fundamentos Profesionales en Redes de Computadoras,https://edutin.com/curso-de-redes-4158,4158,93874
Arquitecturas de dise帽o de una red de datos,ARC UV,https://youtube.com/watch?v=PYDbp4MeImQ,Fundamentos Profesionales en Redes de Computadoras,https://edutin.com/curso-de-redes-4158,4158,93873
Dise帽o de redes de alta disponibilidad,ARC UV,https://youtube.com/watch?v=sDOyNCCBZr8,Fundamentos Profesionales en Redes de Computadoras,https://edutin.com/curso-de-redes-4158,4158,93875
Sensor,Arcadia Fotos,https://youtube.com/watch?v=TcDZuWpEVuc,Diplomado en Fotograf铆a profesional,https://edutin.com/curso-de-fotografia-4300,4300,144727
Abrir un archivo en ArchiCAD,ARCHICAD Canal Espa帽ol,https://youtube.com/watch?v=82a3pn4xrOg,Diplomado en ArchiCAD,https://edutin.com/curso-de-archicad-4346,4346,144397
Conociendo la interfaz,ARCHICAD Canal Espa帽ol,https://youtube.com/watch?v=pq-qI2CUOEI,Diplomado en ArchiCAD,https://edutin.com/curso-de-archicad-4346,4346,105394
Interfaz de usuario de ArchiCAD,ARCHICAD Canal Espa帽ol,https://youtube.com/watch?v=pq-qI2CUOEI,Diplomado en ArchiCAD,https://edutin.com/curso-de-archicad-4346,4346,144396
Modelar una casa en desnivel,Archicad paso a paso,https://youtube.com/watch?v=bzv7iIpLkpM,Diplomado en ArchiCAD,https://edutin.com/curso-de-archicad-4346,4346,160852
Modelar una casa en desnivel,Archicad paso a paso,https://youtube.com/watch?v=pE18O5JpM7I,Diplomado en ArchiCAD,https://edutin.com/curso-de-archicad-4346,4346,144423
Crear plataformas en malla o terreno,Archicad paso a paso,https://youtube.com/watch?v=V6RqEQUDPlk,Diplomado en ArchiCAD,https://edutin.com/curso-de-archicad-4346,4346,144422
Renderizado,Archicad Tutorials 2.0,https://youtube.com/watch?v=7rAGs0bSoV8,Diplomado en ArchiCAD,https://edutin.com/curso-de-archicad-4346,4346,105468
Conceptos BIM,ARCHICAD,https://youtube.com/watch?v=D-tue-ZPThY,Diplomado en ArchiCAD,https://edutin.com/curso-de-archicad-4346,4346,105392
Concepto de  render y sus funciones,Arcux,https://youtube.com/watch?v=kMQA953oAlY,Animaci贸n y Modelado con Maya,https://edutin.com/curso-de-maya-basico-4077,4077,91247
Concepto de ArchiCAD,Arcux,https://youtube.com/watch?v=Yh6OBQYR54Y,Diplomado en ArchiCAD,https://edutin.com/curso-de-archicad-4346,4346,105388
Funcionamiento de las redes inal谩mbricas,AREATECNOLOGIA,https://youtube.com/watch?v=XK5W1nq3WnY,Fundamentos en Ciencias de la Computaci贸n,https://edutin.com/curso-de-introduccion-a-la-computacion-4164,4164,92882
Metodolog铆a Waterfall (cascada),Areli Meneses,https://youtube.com/watch?v=7cxkWDHvQ7Y,Diplomado en Microsoft Project,https://edutin.com/curso-de-project,1920,142506
Abrir Adobe Illustrator,Aries Academia Creativa,https://youtube.com/watch?v=yNm4NkVmecI,Editor de Gr谩ficos Vectoriales con Adobe Illustrator,https://edutin.com/curso-de-illustrator-3738,3738,111160
Renderizado,ARKADIS Architecture & Design Center,https://youtube.com/watch?v=OAlBBxFQdXs,Diplomado en Revit,https://edutin.com/curso-de-revit-4334,4334,104318
Realizar copias de seguridad antes de la actualizaci贸n,Armando Gonzalez,https://youtube.com/watch?v=V6-dysgGGtw,CentOS 7,https://edutin.com/curso-de-centos-7-3841,3841,158683
Rutas de familia,arqMANES,https://youtube.com/watch?v=Ww1DqkyXwmU,Diplomado en Revit,https://edutin.com/curso-de-revit-4334,4334,104269
Suelos o forjados,arqMANES,https://youtube.com/watch?v=yqRC6P1aEoc,Diplomado en Revit,https://edutin.com/curso-de-revit-4334,4334,104400
Concepto arquitect贸nico,ArquiSEJOS,https://youtube.com/watch?v=MY3RVBBxI4A,Diplomado en ArchiCAD,https://edutin.com/curso-de-archicad-4346,4346,144391
Topograf铆a (Importar curvas de nivel desde Autocad),Arquitectura a otro Nivel,https://youtube.com/watch?v=5ScrG-RiWpA,Diplomado en Revit,https://edutin.com/curso-de-revit-4334,4334,104387
Topograf铆a en ArchiCAD,Arsheet,https://youtube.com/watch?v=Vy9SjAxvyWY,Diplomado en ArchiCAD,https://edutin.com/curso-de-archicad-4346,4346,144414
Conceptos b谩sicos de los sistemas operativos de servidor,Arsys,https://youtube.com/watch?v=WqMNDI-VN6A,Diplomado en configuraci贸n y aplicaci贸n de Nano Server para contenedores,https://edutin.com/curso-de-nano-server-3836,3836,158124
Elementos del arte: valores,Arte Divierte,https://youtube.com/watch?v=RITHqhhtZbE,Editor de Gr谩ficos Vectoriales con Adobe Illustrator,https://edutin.com/curso-de-illustrator-3738,3738,111111
Conceptos b谩sicos de la fotograf铆a,ARTENGLISHROOM,https://youtube.com/watch?v=MF0241H_7To,Diplomado en Fotograf铆a profesional,https://edutin.com/curso-de-fotografia-4300,4300,100861
Un mill贸n de kil贸metros de cable para conectar al mundo,aTech ES,https://youtube.com/watch?v=A5ynf0sV9D4,Fundamentos Profesionales en Redes de Computadoras,https://edutin.com/curso-de-redes-4158,4158,93904
Tendencias en la retroalimentaci贸n de CRM aplicada a procesos de ventas,Attitude Academy,https://youtube.com/watch?v=vCtjkMw4K7Y,Diplomado en CRM,https://edutin.com/curso-de-crm-2741,2741,107118
C贸mo dise帽ar un volante,Augusto Brozoski,https://youtube.com/watch?v=vLqCLtqWfUY,Diplomado en Modelado con Catia,https://edutin.com/curso-de-catia-2016,2016,109967
Insertar l铆neas y curvas,Aula en la nube,https://youtube.com/watch?v=_PDUEpJUcUY,Google Drive,https://edutin.com/curso-de-drive-3988,3988,141526
Insertar gr谩ficos,Aula en la nube,https://youtube.com/watch?v=-lcv_nah71w,Google Drive,https://edutin.com/curso-de-drive-3988,3988,141514
Realizar filtros,Aula en la nube,https://youtube.com/watch?v=-m2d2MKh8jM,Google Drive,https://edutin.com/curso-de-drive-3988,3988,141552
"Abrir, crear y exportar documentos",Aula en la nube,https://youtube.com/watch?v=2ZHf9JrG-sE,Google Drive,https://edutin.com/curso-de-drive-3988,3988,141505
"Abrir, crear y exportar presentaciones",Aula en la nube,https://youtube.com/watch?v=3GGiGfAoTb8,Google Drive,https://edutin.com/curso-de-drive-3988,3988,141521
Crear formulario,Aula en la nube,https://youtube.com/watch?v=7lqFn-_u7Pc,Google Drive,https://edutin.com/curso-de-drive-3988,3988,141559
"Inmovilizar, ocultar y agrupar celdas, filas y columnas",Aula en la nube,https://youtube.com/watch?v=8DAb-vnC6sU,Google Drive,https://edutin.com/curso-de-drive-3988,3988,141547
Series de datos,Aula en la nube,https://youtube.com/watch?v=aJRY-q5PwWI,Google Drive,https://edutin.com/curso-de-drive-3988,3988,141545
Importar datos,Aula en la nube,https://youtube.com/watch?v=b8BYseZnKiM,Google Drive,https://edutin.com/curso-de-drive-3988,3988,141550
Insertar y ajustar formas,Aula en la nube,https://youtube.com/watch?v=e42AnxL-jlc,Google Drive,https://edutin.com/curso-de-drive-3988,3988,141512
Personalizar formularios,Aula en la nube,https://youtube.com/watch?v=EL_h_390i3o,Google Drive,https://edutin.com/curso-de-drive-3988,3988,141564
Insertar ecuaciones y f贸rmulas,Aula en la nube,https://youtube.com/watch?v=EmiSpG6Wx30,Google Drive,https://edutin.com/curso-de-drive-3988,3988,141513
Realizar y enviar encuestas,Aula en la nube,https://youtube.com/watch?v=EWSnX7utGzM,Google Drive,https://edutin.com/curso-de-drive-3988,3988,141560
Insertar y ver notas y comentarios,Aula en la nube,https://youtube.com/watch?v=flXqk2ZlF4E,Google Drive,https://edutin.com/curso-de-drive-3988,3988,141557
Uso del teclado y caracteres,Aula en la nube,https://youtube.com/watch?v=Lls0tQSFdeQ,Google Drive,https://edutin.com/curso-de-drive-3988,3988,141507
Formato de celdas,Aula en la nube,https://youtube.com/watch?v=NC77eEt9LHg,Google Drive,https://edutin.com/curso-de-drive-3988,3988,141546
Formato de p谩gina,Aula en la nube,https://youtube.com/watch?v=SsMykDf4z-Q,Google Drive,https://edutin.com/curso-de-drive-3988,3988,141509
Publicar calificaciones y comentarios,Aula en la nube,https://youtube.com/watch?v=u6IjQgmJ1l0,Google Drive,https://edutin.com/curso-de-drive-3988,3988,141566
Insertar formas y figuras,Aula en la nube,https://youtube.com/watch?v=wxXVKzXx6c8,Google Drive,https://edutin.com/curso-de-drive-3988,3988,141525
Interfaz de Sheets,Aula en la nube,https://youtube.com/watch?v=Z2VMC7p5J2Q,Google Drive,https://edutin.com/curso-de-drive-3988,3988,141536
Compartir y edici贸n en grupo,Aula en la nube,https://youtube.com/watch?v=zX2fyDOxhno,Google Drive,https://edutin.com/curso-de-drive-3988,3988,141518
Compartir y edici贸n en grupo,Aula en la nube,https://youtube.com/watch?v=zX2fyDOxhno,Google Drive,https://edutin.com/curso-de-drive-3988,3988,141558
Vi帽etas y numeraci贸n,Aula24Exactas,https://youtube.com/watch?v=jipkeMwGvl0,Diplomado en Microsoft PowerPoint,https://edutin.com/curso-de-powerpoint,546,146534
Gesti贸n de archivos,aulaclic,https://youtube.com/watch?v=IhC3DCzhFe4,Google Drive,https://edutin.com/curso-de-drive-3988,3988,141476
"Crear, abrir, buscar y ver detalles de archivos",aulaclic,https://youtube.com/watch?v=Il3OReecLw8,Google Drive,https://edutin.com/curso-de-drive-3988,3988,141479
Insertar tablas,aulaclic,https://youtube.com/watch?v=jtUTmjiXY60,Google Drive,https://edutin.com/curso-de-drive-3988,3988,141515
Tema y dise帽o de diapositivas,aulaclic,https://youtube.com/watch?v=jv7NzXQniq0,Diplomado en Microsoft PowerPoint,https://edutin.com/curso-de-powerpoint,546,146551
Administraci贸n de archivos,aulaclic,https://youtube.com/watch?v=kVih0FcnenM,Diplomado en Sistema Operativo Windows,https://edutin.com/curso-de-windows,3581,147192
"Copiar, mover, renombrar, destacar y borrar archivos",aulaclic,https://youtube.com/watch?v=XDcTYJLs9XU,Google Drive,https://edutin.com/curso-de-drive-3988,3988,141480
Formato de p谩rrafo,aulaclic,https://youtube.com/watch?v=YkoT_Sn-U58,Google Drive,https://edutin.com/curso-de-drive-3988,3988,141508
Concepto de Revit,Autodesk Building Solutions,https://youtube.com/watch?v=_qqT9j0rzuk,Diplomado en Revit,https://edutin.com/curso-de-revit-4334,4334,104254
Fotograf铆a de producto,Bac谩nika,https://youtube.com/watch?v=k9CkNFKXVnk,Diplomado en Fotograf铆a profesional,https://edutin.com/curso-de-fotografia-4300,4300,100903
Post-Explotaci贸n con meterpreter,Backtrack Academy,https://youtube.com/watch?v=HYjo1ui0EFw,Diplomado en Pentest,https://edutin.com/curso-de-pentest-4369,4369,109051
C贸digo en lenguaje C vs c贸digo en lenguaje maquina,Ben Eater,https://youtube.com/watch?v=yOyaJXpAYZQ,Desarrollador de Algoritmos,https://edutin.com/curso-de-programacion-c,4163,93406
C贸mo dise帽ar el n煤cleo de la h茅lice,Benjam铆n Miranda Tamayo,https://youtube.com/watch?v=_S4wUSQ5-54,Diplomado en Modelado con Catia,https://edutin.com/curso-de-catia-2016,2016,109927
C贸mo dise帽ar la bieleta,Benjam铆n Miranda Tamayo,https://youtube.com/watch?v=433s0b1ioMU,Diplomado en Modelado con Catia,https://edutin.com/curso-de-catia-2016,2016,109925
Dise帽ar motor radial,Benjam铆n Miranda Tamayo,https://youtube.com/watch?v=4r1jVitkQwk,Diplomado en Modelado con Catia,https://edutin.com/curso-de-catia-2016,2016,109921
C贸mo dise帽ar el 茅mbolo,Benjam铆n Miranda Tamayo,https://youtube.com/watch?v=5MVbaS5k-mc,Diplomado en Modelado con Catia,https://edutin.com/curso-de-catia-2016,2016,109924
C贸mo dise帽ar el cilindro,Benjam铆n Miranda Tamayo,https://youtube.com/watch?v=cm867Hho8BQ,Diplomado en Modelado con Catia,https://edutin.com/curso-de-catia-2016,2016,109926
C贸mo dise帽ar el cig眉e帽al,Benjam铆n Miranda Tamayo,https://youtube.com/watch?v=J6PmWYKwg5I,Diplomado en Modelado con Catia,https://edutin.com/curso-de-catia-2016,2016,109922
C贸mo dise帽ar el aspa,Benjam铆n Miranda Tamayo,https://youtube.com/watch?v=jGB_takGZTE,Diplomado en Modelado con Catia,https://edutin.com/curso-de-catia-2016,2016,109928
Ensamble de motor radial,Benjam铆n Miranda Tamayo,https://youtube.com/watch?v=KAbvNUfvc_8,Diplomado en Modelado con Catia,https://edutin.com/curso-de-catia-2016,2016,109929
C贸mo dise帽ar la tapa,Benjam铆n Miranda Tamayo,https://youtube.com/watch?v=LuyUC4T3hSs,Diplomado en Modelado con Catia,https://edutin.com/curso-de-catia-2016,2016,109972
C贸mo dise帽ar la biela madre,Benjam铆n Miranda Tamayo,https://youtube.com/watch?v=txcnY94XROg,Diplomado en Modelado con Catia,https://edutin.com/curso-de-catia-2016,2016,109923
Evoluci贸n de los Sistemas Operativos,Benjamin Vargas R.,https://youtube.com/watch?v=nzo-lRRyWIs,Diplomado en Sistema Operativo Windows,https://edutin.com/curso-de-windows,3581,147135
Historia de Docker,Beny White,https://youtube.com/watch?v=WvprX6Y7pjA,Docker Profesional,https://edutin.com/curso-de-docker-3986,3986,138532
Concepto de Docker y sus ventajas,BettaTech,https://youtube.com/watch?v=Uu49ID0NBRQ,Docker Profesional,https://edutin.com/curso-de-docker-3986,3986,138533
La naturaleza de Microsoft Outlook,Bi_Learning,https://youtube.com/watch?v=AByaHJ7dxDY,Diplomado en Microsoft Outlook,https://edutin.com/curso-de-outlook-1925,1925,145273
Google Docs,Bi_Learning,https://youtube.com/watch?v=JO2PM9irRKw,Google Drive,https://edutin.com/curso-de-drive-3988,3988,141498
C谩maras,Bibliocad,https://youtube.com/watch?v=KOCM2-SRb3A,Diplomado en Revit,https://edutin.com/curso-de-revit-4334,4334,104444
