NombreLeccion,CanalYouTube,UrlYouTube,CursoNombre,CursoUrl,CursoId,LeccionId
Mobiliario,Jack Studio ARQUITECTURA,https://youtube.com/watch?v=50Bwwe8tEhE,Diplomado en Revit,https://edutin.com/curso-de-revit-4334,4334,104313
C贸mo funciona el Internet,JAES Company Espa帽ol,https://youtube.com/watch?v=IOLKrqEvRDA,Fundamentos Profesionales en Redes de Computadoras,https://edutin.com/curso-de-redes-4158,4158,93903
Explorador de Windows,Jaime Lizarraga,https://youtube.com/watch?v=QsS6si6NMEE,Diplomado en Sistema Operativo Windows,https://edutin.com/curso-de-windows,3581,76761
Techos y cubiertas,JARCON Arquitectura e Ingenier铆a,https://youtube.com/watch?v=BHwvJRz3ONY,Diplomado en Revit,https://edutin.com/curso-de-revit-4334,4334,104315
Simulaci贸n de Subneting en Cisco Packet Tracer,JARX189,https://youtube.com/watch?v=LD40T8ugZlw,Fundamentos Profesionales en Redes de Computadoras,https://edutin.com/curso-de-redes-4158,4158,93896
Dns Spoofing con Ettercap y Setoolkit,Javier Camilo,https://youtube.com/watch?v=q5ZrHQmrFFI,Diplomado en Pentest,https://edutin.com/curso-de-pentest-4369,4369,109038
VPN de sitio a sitio,Javier De La Cruz,https://youtube.com/watch?v=pI8TPvFuAyA,Zentyal,https://edutin.com/curso-de-zentyal-3840,3840,159261
Importar malla desde datos externos,JAVIER GONZALEZ,https://youtube.com/watch?v=6iWixa2mdU0,Diplomado en ArchiCAD,https://edutin.com/curso-de-archicad-4346,4346,144416
Seguridad en la nube: consideraciones y mejores pr谩cticas,Javier Mesa,https://youtube.com/watch?v=8_UV1nRo_SI,VMware Workstation,https://edutin.com/curso-de-vmware-workstation-3835,3835,159105
驴C贸mo hacer una buena diapositiva?,Javier Mu帽iz,https://youtube.com/watch?v=SzbvSulJMD0,Diplomado en Microsoft PowerPoint,https://edutin.com/curso-de-powerpoint,546,106190
Proceso de migraci贸n de IPv4 a IPv6,Javier T谩rrega,https://youtube.com/watch?v=utIamZGm1xw,IPv6 Profesional,https://edutin.com/curso-de-ipv6-3548,3548,143314
IPV6,Javier T谩rrega,https://youtube.com/watch?v=WK3fnByI_qw,fundamentos de cisco packet tracer,https://edutin.com/curso-de-Cisco-Packet-Tracer,571,141051
Crear men煤 desplegable,Jazz Guzman,https://youtube.com/watch?v=-E6rXgLY2Zg,Diplomado en Microsoft PowerPoint,https://edutin.com/curso-de-powerpoint,546,106253
Portada creativa en Power Point,Jazz Guzman,https://youtube.com/watch?v=5lvMc812cu8,Diplomado en Microsoft PowerPoint,https://edutin.com/curso-de-powerpoint,546,106261
Fotomontajes en PowerPoint,Jazz Guzman,https://youtube.com/watch?v=MRuR5-u1daI,Diplomado en Microsoft PowerPoint,https://edutin.com/curso-de-powerpoint,546,106199
Aplicaci贸n del efecto clonaci贸n en las diapositivas,Jazz Guzman,https://youtube.com/watch?v=qhRGgocqybc,Diplomado en Microsoft PowerPoint,https://edutin.com/curso-de-powerpoint,546,106277
Introducci贸n de videos con PowerPoint,Jazz Guzman,https://youtube.com/watch?v=qWlJ26JjAVE,Diplomado en Microsoft PowerPoint,https://edutin.com/curso-de-powerpoint,546,106266
Realizar portadas creativas en PowerPoint,Jazz Guzman,https://youtube.com/watch?v=U8__7tXa1GA,Diplomado en Microsoft PowerPoint,https://edutin.com/curso-de-powerpoint,546,106196
Ejecutar comandos en Docker,Jesus Matiz,https://youtube.com/watch?v=jRrzhPJItGQ,Docker Profesional,https://edutin.com/curso-de-docker-3986,3986,152214
Ventajas y desventajas de IPV6,Jesus Vilchez,https://youtube.com/watch?v=cPkGgHejIdY,IPv6 Profesional,https://edutin.com/curso-de-ipv6-3548,3548,143305
Tipos de Switch en Packet Tracer,Jesus Vilchez,https://youtube.com/watch?v=NoIXVuNhRW4,fundamentos de cisco packet tracer,https://edutin.com/curso-de-Cisco-Packet-Tracer,571,140982
Tipos de direcciones,Jesus Vilchez,https://youtube.com/watch?v=PZr7DStuz_I,IPv6 Profesional,https://edutin.com/curso-de-ipv6-3548,3548,143318
Ejecutar comandos dentro de un contenedor,JGAITPro,https://youtube.com/watch?v=_cSn1HcykYY,Docker Profesional,https://edutin.com/curso-de-docker-3986,3986,152219
Configuracion Hyper-v,JGAITPro,https://youtube.com/watch?v=-Y-ScRlxEhk,Diplomado en Virtualizaci贸n con Hyper-V,https://edutin.com/curso-de-hyper-v-3839,3839,153820
Uso de Nano Server Image Builder para crear im谩genes personalizadas de Nano Server,JGAITPro,https://youtube.com/watch?v=11YLAJsjQl8,Diplomado en configuraci贸n y aplicaci贸n de Nano Server para contenedores,https://edutin.com/curso-de-nano-server-3836,3836,158148
Tipos de repositorios y sus caracter铆sticas,JGAITPro,https://youtube.com/watch?v=2LjZbMc9_fM,Curso de Veeam Backup & Replication,https://edutin.com/curso-de-veeam-backup-replication-3838,3838,158839
Resoluci贸n de nombres en DNS,JGAITPro,https://youtube.com/watch?v=3pVd3a1utZo,Zentyal,https://edutin.com/curso-de-zentyal-3840,3840,159248
Configuraci贸n de un recurso compartido de archivos SMB en Nano Server,JGAITPro,https://youtube.com/watch?v=3WoNq_u6xG4,Diplomado en configuraci贸n y aplicaci贸n de Nano Server para contenedores,https://edutin.com/curso-de-nano-server-3836,3836,84995
Instalaci贸n de Centos 07 en modo Minimal,JGAITPro,https://youtube.com/watch?v=5_1hAD17gw0,CentOS 7,https://edutin.com/curso-de-centos-7-3841,3841,158639
Introducci贸n a la tecnolog铆a de contenedores en Nano Server,JGAITPro,https://youtube.com/watch?v=77CrlO3PJYg,Diplomado en configuraci贸n y aplicaci贸n de Nano Server para contenedores,https://edutin.com/curso-de-nano-server-3836,3836,84996
Configuraci贸n de permisos y opciones de seguridad para el recurso compartido,JGAITPro,https://youtube.com/watch?v=7obBZDLCjbo,Diplomado en configuraci贸n y aplicaci贸n de Nano Server para contenedores,https://edutin.com/curso-de-nano-server-3836,3836,158147
Configuraci贸n de permisos de acceso para usuarios y grupos en recursos compartidos de Nano Server.,JGAITPro,https://youtube.com/watch?v=7obBZDLCjbo,Diplomado en configuraci贸n y aplicaci贸n de Nano Server para contenedores,https://edutin.com/curso-de-nano-server-3836,3836,158149
Suite de SysInternals para Nano Server,JGAITPro,https://youtube.com/watch?v=7s0EdE2OQZM,Diplomado en configuraci贸n y aplicaci贸n de Nano Server para contenedores,https://edutin.com/curso-de-nano-server-3836,3836,84998
Crear conmutadores de red virtuales externa,JGAITPro,https://youtube.com/watch?v=9kzoks0u_5Q,Diplomado en Virtualizaci贸n con Hyper-V,https://edutin.com/curso-de-hyper-v-3839,3839,85121
Clonaci贸n de m谩quinas virtuales para despliegues escalables,JGAITPro,https://youtube.com/watch?v=AiFwGsZY4pk,VMware Workstation,https://edutin.com/curso-de-vmware-workstation-3835,3835,159087
Evaluaci贸n de los componentes del entorno de Veeam que pueden impactar el rendimiento,JGAITPro,https://youtube.com/watch?v=baudTGEk2c8,Curso de Veeam Backup & Replication,https://edutin.com/curso-de-veeam-backup-replication-3838,3838,158857
Prevenci贸n de ataques y pr谩cticas de seguridad,JGAITPro,https://youtube.com/watch?v=bdz4zGLKjE8,CentOS 7,https://edutin.com/curso-de-centos-7-3841,3841,158669
Asignaci贸n de recursos y configuraciones b谩sicas,JGAITPro,https://youtube.com/watch?v=BfrWZ9GsFlU,VMware Workstation,https://edutin.com/curso-de-vmware-workstation-3835,3835,159082
Concepto de Desktop Experience,JGAITPro,https://youtube.com/watch?v=bi4-tKowsuE,Diplomado en Windows Server,https://edutin.com/curso-de-windows-server,4485,148245
Configuraci贸n del servidor DNS,JGAITPro,https://youtube.com/watch?v=bmROdq3pRmc,Zentyal,https://edutin.com/curso-de-zentyal-3840,3840,159246
Paso a paso para crear una m谩quina virtual con la imagen de Nano Server en Hyper-V,JGAITPro,https://youtube.com/watch?v=BWT9qVOmGtM,Diplomado en configuraci贸n y aplicaci贸n de Nano Server para contenedores,https://edutin.com/curso-de-nano-server-3836,3836,158140
M茅todos para instalar paquetes y roles adicionales en una instancia de Nano Server,JGAITPro,https://youtube.com/watch?v=CipsbORDajc,Diplomado en configuraci贸n y aplicaci贸n de Nano Server para contenedores,https://edutin.com/curso-de-nano-server-3836,3836,84992
Hyper-V y VMware Workstation,JGAITPro,https://youtube.com/watch?v=dIAgOCDWv30,Diplomado en Virtualizaci贸n con Hyper-V,https://edutin.com/curso-de-hyper-v-3839,3839,85127
Restaurar maquina virtual en Veeam Backup & Replication,JGAITPro,https://youtube.com/watch?v=dsfwStQLgHE,Curso de Veeam Backup & Replication,https://edutin.com/curso-de-veeam-backup-replication-3838,3838,158864
Solucionar PXE Network Boot Using IPv4,JGAITPro,https://youtube.com/watch?v=e4dxQNiCzy4,Diplomado en Virtualizaci贸n con Hyper-V,https://edutin.com/curso-de-hyper-v-3839,3839,153431
Instalar Hyper-V,JGAITPro,https://youtube.com/watch?v=E9qlYxGWoKc,Diplomado en Virtualizaci贸n con Hyper-V,https://edutin.com/curso-de-hyper-v-3839,3839,153325
Programaci贸n y retenci贸n de copias de seguridad,JGAITPro,https://youtube.com/watch?v=eFa6JcML3OQ,Curso de Veeam Backup & Replication,https://edutin.com/curso-de-veeam-backup-replication-3838,3838,158834
Concepto de contenedores y tipolog铆a en Windows Server,JGAITPro,https://youtube.com/watch?v=EFAfIApdrMY,Diplomado en Windows Server,https://edutin.com/curso-de-windows-server,4485,148275
Roles y uso de Windows Server,JGAITPro,https://youtube.com/watch?v=eQeGVLfH2Tk,Diplomado en Windows Server,https://edutin.com/curso-de-windows-server,4485,148249
Configuraci贸n y gesti贸n de reglas del Firewall de Windows en Nano Server,JGAITPro,https://youtube.com/watch?v=Eqi7wTiM8Gs,Diplomado en configuraci贸n y aplicaci贸n de Nano Server para contenedores,https://edutin.com/curso-de-nano-server-3836,3836,85000
Conexi贸n a m谩quinas virtuales,JGAITPro,https://youtube.com/watch?v=flm0jIAL4Xc,Diplomado en Virtualizaci贸n con Hyper-V,https://edutin.com/curso-de-hyper-v-3839,3839,153428
Copiar archivos a Nano Server con PowerShell Direct,JGAITPro,https://youtube.com/watch?v=FNJ8-SXIVjs,Diplomado en configuraci贸n y aplicaci贸n de Nano Server para contenedores,https://edutin.com/curso-de-nano-server-3836,3836,158142
"Configuraci贸n de hardware virtual (CPU, memoria, almacenamiento)",JGAITPro,https://youtube.com/watch?v=fSfXjZ-KtXc,VMware Workstation,https://edutin.com/curso-de-vmware-workstation-3835,3835,159084
Integraci贸n con almacenamiento,JGAITPro,https://youtube.com/watch?v=g7PBMzTEFwM,Curso de Veeam Backup & Replication,https://edutin.com/curso-de-veeam-backup-replication-3838,3838,158855
Configuraci贸n del sistema,JGAITPro,https://youtube.com/watch?v=gcaxOCODzKo,Zentyal,https://edutin.com/curso-de-zentyal-3840,3840,159236
Presentaci贸n de Centos 08 y su prop贸sito,JGAITPro,https://youtube.com/watch?v=gzhurex5Iow,CentOS 7,https://edutin.com/curso-de-centos-7-3841,3841,158681
Configuraci贸n del servidor DHCP,JGAITPro,https://youtube.com/watch?v=H5lhAKOH5LM,Zentyal,https://edutin.com/curso-de-zentyal-3840,3840,159243
Conectar discos duros virtuales VHDX a m谩quinas virtuales,JGAITPro,https://youtube.com/watch?v=HUU32mXcQDY,Diplomado en Virtualizaci贸n con Hyper-V,https://edutin.com/curso-de-hyper-v-3839,3839,153426
Proceso para crear un disco duro virtual (VHD) con una imagen de Nano Server,JGAITPro,https://youtube.com/watch?v=inNupAfFMy4,Diplomado en configuraci贸n y aplicaci贸n de Nano Server para contenedores,https://edutin.com/curso-de-nano-server-3836,3836,84991
Definici贸n de grupos,JGAITPro,https://youtube.com/watch?v=jGerevH5nIo,Zentyal,https://edutin.com/curso-de-zentyal-3840,3840,159238
Creaci贸n y administraci贸n de instant谩neas,JGAITPro,https://youtube.com/watch?v=l1xTzKyV6BU,VMware Workstation,https://edutin.com/curso-de-vmware-workstation-3835,3835,159086
Configuraci贸n y uso del Administrador del servidor para administrar Nano Server de forma remota,JGAITPro,https://youtube.com/watch?v=L2OT2iUSMpc,Diplomado en configuraci贸n y aplicaci贸n de Nano Server para contenedores,https://edutin.com/curso-de-nano-server-3836,3836,158137
Windows Defender en Nano Configuraci贸n y gesti贸n de Windows Defender para proteger Nano Server contra amenazas de seguridad,JGAITPro,https://youtube.com/watch?v=llaRdtxRqjQ,Diplomado en configuraci贸n y aplicaci贸n de Nano Server para contenedores,https://edutin.com/curso-de-nano-server-3836,3836,158151
Crear Discos Duros Virtuales VHDX,JGAITPro,https://youtube.com/watch?v=ln9gY2ho7tc,Diplomado en Virtualizaci贸n con Hyper-V,https://edutin.com/curso-de-hyper-v-3839,3839,153423
Instalaci贸n de CentOS 7 en modo Desktop,JGAITPro,https://youtube.com/watch?v=Lr3WJ6qvEVs,CentOS 7,https://edutin.com/curso-de-centos-7-3841,3841,85154
Navegaci贸n por el sistema de archivos,JGAITPro,https://youtube.com/watch?v=LsBGqcLQszY,CentOS 7,https://edutin.com/curso-de-centos-7-3841,3841,158654
Creaci贸n y gesti贸n de usuarios,JGAITPro,https://youtube.com/watch?v=lXjbDjiY47w,Zentyal,https://edutin.com/curso-de-zentyal-3840,3840,159237
Pasos para aplicar la actualizaci贸n en Windows Server,JGAITPro,https://youtube.com/watch?v=MlqkZM7CXk4,Diplomado en Windows Server,https://edutin.com/curso-de-windows-server,4485,153701
驴Qu茅 es Veeam Backup & Replication?,JGAITPro,https://youtube.com/watch?v=Nov_MCO1Cys,Curso de Veeam Backup & Replication,https://edutin.com/curso-de-veeam-backup-replication-3838,3838,158806
Acceso a archivos desde sistemas Windows y Linux,JGAITPro,https://youtube.com/watch?v=npZauKzGpkY,Zentyal,https://edutin.com/curso-de-zentyal-3840,3840,159250
Medios de instalaci贸n,JGAITPro,https://youtube.com/watch?v=O93tyNGb6EQ,CentOS 7,https://edutin.com/curso-de-centos-7-3841,3841,158634
Habilitar Virtualizaci贸n anidada,JGAITPro,https://youtube.com/watch?v=On1t5AXTJmA,Diplomado en Virtualizaci贸n con Hyper-V,https://edutin.com/curso-de-hyper-v-3839,3839,85126
Beneficios y ventajas de usar Zentyal en diferentes entornos,JGAITPro,https://youtube.com/watch?v=PD05RvPIC6s,Zentyal,https://edutin.com/curso-de-zentyal-3840,3840,159227
Modos de instalaci贸n en Centos 07,JGAITPro,https://youtube.com/watch?v=pxtvj-Idfcw,CentOS 7,https://edutin.com/curso-de-centos-7-3841,3841,158636
驴Qu茅 es Hyper-V?,JGAITPro,https://youtube.com/watch?v=QgX0wDz4B2U,Diplomado en Virtualizaci贸n con Hyper-V,https://edutin.com/curso-de-hyper-v-3839,3839,153277
"Concepto, caracter铆sticas y funciones de Hyper-V",JGAITPro,https://youtube.com/watch?v=QgX0wDz4B2U,Diplomado en Windows Server,https://edutin.com/curso-de-windows-server,4485,148274
Proceso de instalaci贸n del paquete de servidor IIS (Internet Information Services) en Nano Server,JGAITPro,https://youtube.com/watch?v=qo7fIdsKpec,Diplomado en configuraci贸n y aplicaci贸n de Nano Server para contenedores,https://edutin.com/curso-de-nano-server-3836,3836,158144
Conectar dispositivos USB a m谩quinas virtuales,JGAITPro,https://youtube.com/watch?v=r7LJxxJOfpc,Diplomado en Virtualizaci贸n con Hyper-V,https://edutin.com/curso-de-hyper-v-3839,3839,153429
Principales caracter铆sticas de Nano Server,JGAITPro,https://youtube.com/watch?v=rPOGqk6W7Wk,Diplomado en configuraci贸n y aplicaci贸n de Nano Server para contenedores,https://edutin.com/curso-de-nano-server-3836,3836,158129
Administrar y configurar Nano Server directamente a trav茅s de PowerShell Direct,JGAITPro,https://youtube.com/watch?v=StRzYqc_DPA,Diplomado en configuraci贸n y aplicaci贸n de Nano Server para contenedores,https://edutin.com/curso-de-nano-server-3836,3836,158141
Proceso de unir Nano Server a un dominio de Active Directory,JGAITPro,https://youtube.com/watch?v=SyekdL652AA,Diplomado en configuraci贸n y aplicaci贸n de Nano Server para contenedores,https://edutin.com/curso-de-nano-server-3836,3836,158152
Conceptos de Zentyal,JGAITPro,https://youtube.com/watch?v=tbrA3UIWXgE,Zentyal,https://edutin.com/curso-de-zentyal-3840,3840,159225
Creaci贸n y gesti贸n de usuarios y grupos locales en Nano Server,JGAITPro,https://youtube.com/watch?v=TdWqnQtOYZg,Diplomado en configuraci贸n y aplicaci贸n de Nano Server para contenedores,https://edutin.com/curso-de-nano-server-3836,3836,84997
Pasos para configurar la virtualizaci贸n y el desarrollo de m谩quinas virtuales,JGAITPro,https://youtube.com/watch?v=thXg9E9WjzQ,Diplomado en Windows Server,https://edutin.com/curso-de-windows-server,4485,148278
Uso de la funci贸n de conexi贸n remota de Windows PowerShell ISE para administrar Nano Server,JGAITPro,https://youtube.com/watch?v=tPJUoJlcXck,Diplomado en configuraci贸n y aplicaci贸n de Nano Server para contenedores,https://edutin.com/curso-de-nano-server-3836,3836,158153
Funciones comunes en la consola,JGAITPro,https://youtube.com/watch?v=TWCwkQt2vMs,Curso de Veeam Backup & Replication,https://edutin.com/curso-de-veeam-backup-replication-3838,3838,158837
Creaci贸n y gesti贸n de usuarios,JGAITPro,https://youtube.com/watch?v=vimD5Gwwpu4,CentOS 7,https://edutin.com/curso-de-centos-7-3841,3841,85161
Funciones y responsabilidades de cada componente,JGAITPro,https://youtube.com/watch?v=vJpxgEdZcxI,Curso de Veeam Backup & Replication,https://edutin.com/curso-de-veeam-backup-replication-3838,3838,158812
Manipulaci贸n de archivos y directorios,JGAITPro,https://youtube.com/watch?v=vjq3ZkaLoGU,CentOS 7,https://edutin.com/curso-de-centos-7-3841,3841,158657
Rol de Hyper-V de Windows Server 2016 en m谩quina virtual de Hyper-V,JGAITPro,https://youtube.com/watch?v=whw9EFRgCsw,Diplomado en Virtualizaci贸n con Hyper-V,https://edutin.com/curso-de-hyper-v-3839,3839,85134
Instalar Rol de Hyper-V de Windows Server,JGAITPro,https://youtube.com/watch?v=whw9EFRgCsw,Diplomado en Virtualizaci贸n con Hyper-V,https://edutin.com/curso-de-hyper-v-3839,3839,153434
Funciones de delegaci贸n de privilegios,JGAITPro,https://youtube.com/watch?v=WMWo_yNsS1A,Diplomado en Windows Server,https://edutin.com/curso-de-windows-server,4485,148248
Crear plantillas de m谩quinas virtuales,JGAITPro,https://youtube.com/watch?v=xobcCTt16sI,Diplomado en Virtualizaci贸n con Hyper-V,https://edutin.com/curso-de-hyper-v-3839,3839,153432
Pol铆ticas de acceso,JGAITPro,https://youtube.com/watch?v=YqfELTJa0iE,Zentyal,https://edutin.com/curso-de-zentyal-3840,3840,159239
Aplicar color,Jimmy Lemus,https://youtube.com/watch?v=-4wIsAA2aBE,Animaci贸n y Modelado con Maya,https://edutin.com/curso-de-maya-basico-4077,4077,147312
Concepto de CAD,JimmyHerreraOficial,https://youtube.com/watch?v=QZQEidIIJ3Q,Diplomado en Modelado con Catia,https://edutin.com/curso-de-catia-2016,2016,109817
Administraci贸n y monitoreo de la seguridad en entornos de nube utilizando VMware Workstation,JMG Virtual Consulting,https://youtube.com/watch?v=7-28DHNXs08,VMware Workstation,https://edutin.com/curso-de-vmware-workstation-3835,3835,159107
Hacer fotograf铆as con poca luz,Joan Vendrell,https://youtube.com/watch?v=4RPAcXsIvd4,Diplomado en Fotograf铆a profesional,https://edutin.com/curso-de-fotografia-4300,4300,100979
Equipos de iluminaci贸n,Joan Vendrell,https://youtube.com/watch?v=BAPbg5vD7kM,Diplomado en Producci贸n Audiovisual,https://edutin.com/curso-de-produccion-audiovisual-2081,2081,113393
Ley de reciprocidad,Joan Vendrell,https://youtube.com/watch?v=E1YU8NHD6WA,Diplomado en Fotograf铆a profesional,https://edutin.com/curso-de-fotografia-4300,4300,100968
Ajuste modo manual,Joan Vendrell,https://youtube.com/watch?v=lEBEdRwAlYs,Diplomado en Fotograf铆a profesional,https://edutin.com/curso-de-fotografia-4300,4300,144724
Triangulo de exposici贸n,Joan Vendrell,https://youtube.com/watch?v=o-dj6qprNoM,Diplomado en Fotograf铆a profesional,https://edutin.com/curso-de-fotografia-4300,4300,100952
Lentes,Joan Vendrell,https://youtube.com/watch?v=oJafUgWEPXI,Diplomado en Fotograf铆a profesional,https://edutin.com/curso-de-fotografia-4300,4300,144726
Efecto barrido,Joan Vendrell,https://youtube.com/watch?v=Uw8x7SSrOf0,Diplomado en Fotograf铆a profesional,https://edutin.com/curso-de-fotografia-4300,4300,100977
Funcionamiento de una c谩mara digital,Joan Vendrell,https://youtube.com/watch?v=v4pEVAXhJro,Diplomado en Fotograf铆a profesional,https://edutin.com/curso-de-fotografia-4300,4300,144721
La importancia de la luz,Joan Vendrell,https://youtube.com/watch?v=vF_QaMk7BAg,Diplomado en Fotograf铆a profesional,https://edutin.com/curso-de-fotografia-4300,4300,100905
Importar planos de AutoCAD a Revit,Jordy Nontol,https://youtube.com/watch?v=GNvbg4Ub88E,Diplomado en Revit,https://edutin.com/curso-de-revit-4334,4334,104379
Sliders,Jorge Aguilar,https://youtube.com/watch?v=ixaol4FGkVk,Diplomado en Producci贸n Audiovisual,https://edutin.com/curso-de-produccion-audiovisual-2081,2081,113390
Acceso a los paneles de control y vistas principales,Jorge de la Cruz,https://youtube.com/watch?v=Azug6BaXSq0,Curso de Veeam Backup & Replication,https://edutin.com/curso-de-veeam-backup-replication-3838,3838,158836
Concepto de gesti贸n de proyectos,Jorge Moreno,https://youtube.com/watch?v=yX-GmmfslWQ,Diplomado en ArchiCAD,https://edutin.com/curso-de-archicad-4346,4346,144493
Evoluci贸n de Microsoft Windows,Jos茅 - Desarrollo Web,https://youtube.com/watch?v=_6lYpM4O2xY,Diplomado en Sistema Operativo Windows,https://edutin.com/curso-de-windows,3581,147139
Liberar espacio en Drive,Jos茅 David,https://youtube.com/watch?v=PO7n6Lo8qrE,Google Drive,https://edutin.com/curso-de-drive-3988,3988,141474
Configuraci贸n de cortafuegos (firewall),Jos茅 Huam谩n,https://youtube.com/watch?v=kzDz9njku44,CentOS 7,https://edutin.com/curso-de-centos-7-3841,3841,85177
Trabajo colaborativo en PowerPoint,Jose Luis Ramirez Vargas,https://youtube.com/watch?v=Y4GoinZkV5c,Diplomado en Microsoft PowerPoint,https://edutin.com/curso-de-powerpoint,546,146460
Niveles,JOS MANUEL TECH,https://youtube.com/watch?v=-CJvnGi0BHo,Diplomado en Revit,https://edutin.com/curso-de-revit-4334,4334,104350
Cortes o secciones,JOS MANUEL TECH,https://youtube.com/watch?v=crWaCb4hLXE,Diplomado en Revit,https://edutin.com/curso-de-revit-4334,4334,104351
驴C贸mo empezar en la seguridad inform谩tica?,Jose Maria Alonso,https://youtube.com/watch?v=t4UgRVPvcOc,Diplomado en Pentest,https://edutin.com/curso-de-pentest-4369,4369,108658
Alojamiento de sitios web,Jos茅 Miranda,https://youtube.com/watch?v=v1rn0Z4JZmk,Zentyal,https://edutin.com/curso-de-zentyal-3840,3840,159257
Dise帽ar un p贸ster desde cero,Josh Mahaby Dise帽o y Arte,https://youtube.com/watch?v=79-_ZHXag2U,Editor de Gr谩ficos Vectoriales con Adobe Illustrator,https://edutin.com/curso-de-illustrator-3738,3738,111341
Configuraci贸n de seguridad,Josu Jim茅nez P茅rez,https://youtube.com/watch?v=JTXzfEyYtEs,Zentyal,https://edutin.com/curso-de-zentyal-3840,3840,159258
Herramienta de muros en ArchiCAD,Josu茅 Mundocorre,https://youtube.com/watch?v=rOFalPQr04Q,Diplomado en ArchiCAD,https://edutin.com/curso-de-archicad-4346,4346,144408
Concepto de DNS e IPAM de la infraestructura en red de Windows Server,JP Learning,https://youtube.com/watch?v=tvfKzJtWXU8,Diplomado en Windows Server,https://edutin.com/curso-de-windows-server,4485,148262
Historia de la fotograf铆a,Juan Antonio Palacios,https://youtube.com/watch?v=BcNdQ6e4vEw,Diplomado en Fotograf铆a profesional,https://edutin.com/curso-de-fotografia-4300,4300,100864
Introducci贸n de las herramientas de actualizaci贸n de Centos 08 (DNF),"Juan C. Guzm谩n (Linux, Cibersegurirad y m谩s)",https://youtube.com/watch?v=cxN9YJeMJ9M,CentOS 7,https://edutin.com/curso-de-centos-7-3841,3841,158684
Concepto de Centos 07,"Juan C. Guzm谩n (Linux, Cibersegurirad y m谩s)",https://youtube.com/watch?v=EpXw2k2S81U,CentOS 7,https://edutin.com/curso-de-centos-7-3841,3841,158630
Fases y procesos de la planificaci贸n de proyectos,Juan Carlos Donado Bravo,https://youtube.com/watch?v=nJC2j-st7TU,Diplomado en Microsoft Project,https://edutin.com/curso-de-project,1920,142484
Crear recursos,Juan Carlos Pancorbo,https://youtube.com/watch?v=yK5NzQ57Kzk,Diplomado en Microsoft Project,https://edutin.com/curso-de-project,1920,142799
Creaci贸n y gesti贸n de grupos,Juan Emilio Mateo,https://youtube.com/watch?v=jftEqbeiVGQ,CentOS 7,https://edutin.com/curso-de-centos-7-3841,3841,158658
Conociendo los Routers y su configuraci贸n,Juan Esquivel M茅ndez,https://youtube.com/watch?v=v4o78tx-ttc,fundamentos de cisco packet tracer,https://edutin.com/curso-de-Cisco-Packet-Tracer,571,140983
Herramienta pincel de manchas,Juan Lima,https://youtube.com/watch?v=5S4qOLhVLw0,Editor de Gr谩ficos Vectoriales con Adobe Illustrator,https://edutin.com/curso-de-illustrator-3738,3738,111255
Herramienta reflejo,Juan Lima,https://youtube.com/watch?v=HJ27A5bWka4,Editor de Gr谩ficos Vectoriales con Adobe Illustrator,https://edutin.com/curso-de-illustrator-3738,3738,111332
Ordenar datos alfab茅ticamente,Juan S Guzman,https://youtube.com/watch?v=08sobzFcW8g,Google Drive,https://edutin.com/curso-de-drive-3988,3988,141551
Ver historial,Juan S Guzman,https://youtube.com/watch?v=32YZNKH8Zek,Google Drive,https://edutin.com/curso-de-drive-3988,3988,141556
Google Sheets,Juan S Guzman,https://youtube.com/watch?v=Si8niMXfXY8,Google Drive,https://edutin.com/curso-de-drive-3988,3988,141499
Concepto de autoconfiguraci贸n,Juancar Molinero,https://youtube.com/watch?v=EGuaqFdG_jg,IPv6 Profesional,https://edutin.com/curso-de-ipv6-3548,3548,143319
Introducci贸n,JuanPedroTV,https://youtube.com/watch?v=eaHdzRpw_xY,Diplomado en Fotograf铆a profesional,https://edutin.com/curso-de-fotografia-4300,4300,144718
"Hardware, sus componentes internos y externos",Julio Joshe,https://youtube.com/watch?v=3JmTqay0vz0,Fundamentos en Ciencias de la Computaci贸n,https://edutin.com/curso-de-introduccion-a-la-computacion-4164,4164,92887
Origen y expansi贸n mundial de la fotograf铆a,Julio Joshe,https://youtube.com/watch?v=f38uVq4pHMI,Diplomado en Fotograf铆a profesional,https://edutin.com/curso-de-fotografia-4300,4300,144938
"Abrir, crear hojas de c谩lculo",Julio Soto MX,https://youtube.com/watch?v=GGLdC71EuFU,Google Drive,https://edutin.com/curso-de-drive-3988,3988,141543
Opciones de descubrimiento,Julio Ure帽a,https://youtube.com/watch?v=i_9Rc3xGXKM,Diplomado en Pentest,https://edutin.com/curso-de-pentest-4369,4369,108984
