NombreLeccion,CanalYouTube,UrlYouTube,CursoNombre,CursoUrl,CursoId,LeccionId
Creaci贸n de tablas en PowerPoint,OGMA Consultor铆a,https://youtube.com/watch?v=N3MrH6v332o,Diplomado en Microsoft PowerPoint,https://edutin.com/curso-de-powerpoint,546,146541
Diferencias entre Windows 10 y Windows 11,Omar Castaneda,https://youtube.com/watch?v=W1lONyu3wok,Diplomado en Sistema Operativo Windows,https://edutin.com/curso-de-windows,3581,147268
Gesti贸n de parches de seguridad Windows,OneTronic1,https://youtube.com/watch?v=WKK5t3sjMmc,Diplomado en Sistema Operativo Windows,https://edutin.com/curso-de-windows,3581,147226
Hacking vs Pentesting,OpenWebinars,https://youtube.com/watch?v=_mTgAxtRKNg,Diplomado en Pentest,https://edutin.com/curso-de-pentest-4369,4369,108659
驴Qu茅 es XSS?,OpenWebinars,https://youtube.com/watch?v=inCS6PQYu34,Diplomado en Pentest,https://edutin.com/curso-de-pentest-4369,4369,109044
Autoconfiguraci贸n Stateless,OpenWebinars,https://youtube.com/watch?v=MndaZaCo6xk,IPv6 Profesional,https://edutin.com/curso-de-ipv6-3548,3548,143320
Objetivos de IPV6,OpenWebinars,https://youtube.com/watch?v=s-dmjs1PJuU,IPv6 Profesional,https://edutin.com/curso-de-ipv6-3548,3548,143303
HTTrack,OpErs LiNuX - La Red De Los Inform谩ticos,https://youtube.com/watch?v=7g-Dgr2HKYU,Diplomado en Pentest,https://edutin.com/curso-de-pentest-4369,4369,108982
Tipos de metodolog铆as para el desarrollo de proyectos,OPM Integral,https://youtube.com/watch?v=grgqnoQXPs4,Diplomado en Microsoft Project,https://edutin.com/curso-de-project,1920,142505
Acceso a Google Drive,Orientaci贸n Skolmi,https://youtube.com/watch?v=mSCZORTwrPo,Google Drive,https://edutin.com/curso-de-drive-3988,3988,141467
Modelado con imagen de referencia,Orlando 3D,https://youtube.com/watch?v=U2eX1wmA9JQ,Animaci贸n y Modelado con Maya,https://edutin.com/curso-de-maya-basico-4077,4077,147317
Concepto de boceto,Oscar Gil,https://youtube.com/watch?v=8meyLuFm6Bk,Editor de Gr谩ficos Vectoriales con Adobe Illustrator,https://edutin.com/curso-de-illustrator-3738,3738,111150
Las artes universales del dise帽o gr谩fico,Oscar Valdivieso,https://youtube.com/watch?v=CF_pmIOmnJ0,Editor de Gr谩ficos Vectoriales con Adobe Illustrator,https://edutin.com/curso-de-illustrator-3738,3738,111062
Como crear un CRM en Access,Oscar Webmaster,https://youtube.com/watch?v=dY5C-P9L3g8,Diplomado en CRM,https://edutin.com/curso-de-crm-2741,2741,161538
Fotograf铆a art铆stica,OSCARENFOTOS,https://youtube.com/watch?v=tn8ZBNT4jpc,Diplomado en Fotograf铆a profesional,https://edutin.com/curso-de-fotografia-4300,4300,100902
Insertar citas y bibliograf铆a,Otto C贸rdova,https://youtube.com/watch?v=eYA0fIhxqM4,Google Drive,https://edutin.com/curso-de-drive-3988,3988,141516
Insertar y ajustar im谩genes,Otto C贸rdova,https://youtube.com/watch?v=idN1p9yQYIQ,Google Drive,https://edutin.com/curso-de-drive-3988,3988,141511
Backups status and configuraci贸n Windows 10,Pablo Martinez,https://youtube.com/watch?v=ENgkTKq_Hkc,Diplomado en Sistema Operativo Windows,https://edutin.com/curso-de-windows,3581,76760
Configuraci贸n de conexiones de red para la nube,Pablo Martinez,https://youtube.com/watch?v=krMYoSPjO3g,VMware Workstation,https://edutin.com/curso-de-vmware-workstation-3835,3835,159095
Navegaci贸n y estructura de la interfaz,Pablo Martinez,https://youtube.com/watch?v=qr6YOOoMpLY,Curso de Veeam Backup & Replication,https://edutin.com/curso-de-veeam-backup-replication-3838,3838,158835
Herramientas de migraci贸n,Pablo Martinez,https://youtube.com/watch?v=Ur1G5YdEbis,Diplomado en Windows Server,https://edutin.com/curso-de-windows-server,4485,153700
Footprinting,Paco Sepulveda,https://youtube.com/watch?v=yrRgb9KvmW0,Diplomado en Pentest,https://edutin.com/curso-de-pentest-4369,4369,109040
Interfaz de Docs,Para innovadores SSerme帽o,https://youtube.com/watch?v=qqtOQFnE844,Google Drive,https://edutin.com/curso-de-drive-3988,3988,141504
Fundamentos de Cloud y Virtualizaci贸n,Paulo Colom茅s,https://youtube.com/watch?v=Tp9GVi7djvQ,Fundamentos Profesionales en Redes de Computadoras,https://edutin.com/curso-de-redes-4158,4158,93905
Concepto y aplicaci贸n de redes en Docker,Pelado Nerd,https://youtube.com/watch?v=BNHNMoSJz4g,Docker Profesional,https://edutin.com/curso-de-docker-3986,3986,152164
Dockerfile,Pelado Nerd,https://youtube.com/watch?v=X6YU0q8fBFc,Docker Profesional,https://edutin.com/curso-de-docker-3986,3986,152158
Proceso de instalaci贸n de Nano Server,Peter Chirinos,https://youtube.com/watch?v=H8Vu5VD9490,Diplomado en configuraci贸n y aplicaci贸n de Nano Server para contenedores,https://edutin.com/curso-de-nano-server-3836,3836,158135
Herramientas para efectos,Phicsion,https://youtube.com/watch?v=-78EJGmbrnk,Diplomado en Fotograf铆a profesional,https://edutin.com/curso-de-fotografia-4300,4300,144736
Ajustes necesarios para filmar con c谩mara r茅flex digital,Photogram Spot,https://youtube.com/watch?v=TQSWO6bFFMQ,Diplomado en Producci贸n Audiovisual,https://edutin.com/curso-de-produccion-audiovisual-2081,2081,104077
Principios de la animaci贸n,Pildorea,https://youtube.com/watch?v=a6Ts93tsTZU,Animaci贸n y Modelado con Maya,https://edutin.com/curso-de-maya-basico-4077,4077,91249
M煤ltiple exposici贸n,Pintando con luz,https://youtube.com/watch?v=FXOFPXcGQmk,Diplomado en Fotograf铆a profesional,https://edutin.com/curso-de-fotografia-4300,4300,100974
Los errores de seguridad inform谩tica m谩s comunes en las empresas,Platzi Creators,https://youtube.com/watch?v=OYRrvcL0oAw,Diplomado en Pentest,https://edutin.com/curso-de-pentest-4369,4369,109050
Tips de seguridad inform谩tica para proteger la empresa,Platzi,https://youtube.com/watch?v=YMuhhCH_Gv8,Diplomado en Pentest,https://edutin.com/curso-de-pentest-4369,4369,109049
Men煤 insertar,PlayTIC - Soluciones Inform谩ticas,https://youtube.com/watch?v=RcdyxqDWHsI,Diplomado en Microsoft PowerPoint,https://edutin.com/curso-de-powerpoint,546,146537
Los roles para gestionar los proyectos,PMPeople,https://youtube.com/watch?v=GabaghqnpVk,Diplomado en Microsoft Project,https://edutin.com/curso-de-project,1920,142518
IPv6,Poder Tecnolog铆a,https://youtube.com/watch?v=z1-OTZd3J5k,IPv6 Profesional,https://edutin.com/curso-de-ipv6-3548,3548,75835
Conociendo el enrutamiento est谩tico,Portal Mecatr贸nica,https://youtube.com/watch?v=5kuar2gMIAA,fundamentos de cisco packet tracer,https://edutin.com/curso-de-Cisco-Packet-Tracer,571,140995
Conocer la informaci贸n de un archivo,Princippia Formaci贸n y Consultor铆a,https://youtube.com/watch?v=_7Rt2QYmMIM,Google Drive,https://edutin.com/curso-de-drive-3988,3988,141482
Crear accesos directos de un archivo,Princippia Formaci贸n y Consultor铆a,https://youtube.com/watch?v=_EixVfxbb3E,Google Drive,https://edutin.com/curso-de-drive-3988,3988,144673
Descargar el contenido de una carpeta,Princippia Formaci贸n y Consultor铆a,https://youtube.com/watch?v=0v_mzvsMDF8,Google Drive,https://edutin.com/curso-de-drive-3988,3988,144653
Roles en Drive,Princippia Formaci贸n y Consultor铆a,https://youtube.com/watch?v=1JsvyUhFPgk,Google Drive,https://edutin.com/curso-de-drive-3988,3988,141486
Usar los grupos en drive,Princippia Formaci贸n y Consultor铆a,https://youtube.com/watch?v=3blQ3INm_EU,Google Drive,https://edutin.com/curso-de-drive-3988,3988,144682
Mover una carpeta,Princippia Formaci贸n y Consultor铆a,https://youtube.com/watch?v=6a0KRb_L7yo,Google Drive,https://edutin.com/curso-de-drive-3988,3988,144651
Trabajar con varias cuentas de Google drive o Gmail a la vez,Princippia Formaci贸n y Consultor铆a,https://youtube.com/watch?v=7k45Ga3dmsA,Google Drive,https://edutin.com/curso-de-drive-3988,3988,144685
Asignar color a una carpeta,Princippia Formaci贸n y Consultor铆a,https://youtube.com/watch?v=7rOMcRW9DXw,Google Drive,https://edutin.com/curso-de-drive-3988,3988,144652
Configurar con qui茅n compartir en Drive,Princippia Formaci贸n y Consultor铆a,https://youtube.com/watch?v=91MqT-jFa2Q,Google Drive,https://edutin.com/curso-de-drive-3988,3988,141487
Acceder a una carpeta de Google drive desde escritorio,Princippia Formaci贸n y Consultor铆a,https://youtube.com/watch?v=9BkRTQGtO0A,Google Drive,https://edutin.com/curso-de-drive-3988,3988,144687
Subir una carpeta a la nube,Princippia Formaci贸n y Consultor铆a,https://youtube.com/watch?v=aWOkINi0ITU,Google Drive,https://edutin.com/curso-de-drive-3988,3988,144655
Subir un archivo a Google drive,Princippia Formaci贸n y Consultor铆a,https://youtube.com/watch?v=btRCZbslB88,Google Drive,https://edutin.com/curso-de-drive-3988,3988,144668
Buscar en Google drive,Princippia Formaci贸n y Consultor铆a,https://youtube.com/watch?v=e3df5DOzHgc,Google Drive,https://edutin.com/curso-de-drive-3988,3988,144677
A帽ade m谩s seguridad en tu cuenta,Princippia Formaci贸n y Consultor铆a,https://youtube.com/watch?v=E4jORZGyGGQ,Google Drive,https://edutin.com/curso-de-drive-3988,3988,144681
Subir varios archivos a la vez,Princippia Formaci贸n y Consultor铆a,https://youtube.com/watch?v=Ff-3RAucDbE,Google Drive,https://edutin.com/curso-de-drive-3988,3988,144670
Utilizar drive sin conexi贸n,Princippia Formaci贸n y Consultor铆a,https://youtube.com/watch?v=fJ5NfMFwoAQ,Google Drive,https://edutin.com/curso-de-drive-3988,3988,144678
Navegaci贸n an贸nima en equipos compartidos,Princippia Formaci贸n y Consultor铆a,https://youtube.com/watch?v=FMxuFFQntkY,Google Drive,https://edutin.com/curso-de-drive-3988,3988,89297
Permisos especiales para lectores,Princippia Formaci贸n y Consultor铆a,https://youtube.com/watch?v=fO5TJBbxNr4,Google Drive,https://edutin.com/curso-de-drive-3988,3988,141491
Subir fotos desde mi m贸vil o Tablet,Princippia Formaci贸n y Consultor铆a,https://youtube.com/watch?v=hJURxiw_ZHc,Google Drive,https://edutin.com/curso-de-drive-3988,3988,144684
Conectar aplicaciones externas,Princippia Formaci贸n y Consultor铆a,https://youtube.com/watch?v=hnZQJXCpArQ,Google Drive,https://edutin.com/curso-de-drive-3988,3988,144683
A帽adir archivos compartidos conmigo,Princippia Formaci贸n y Consultor铆a,https://youtube.com/watch?v=HYlnc8VFugs,Google Drive,https://edutin.com/curso-de-drive-3988,3988,141495
Mover archivos en drive,Princippia Formaci贸n y Consultor铆a,https://youtube.com/watch?v=iuz0onkuJLk,Google Drive,https://edutin.com/curso-de-drive-3988,3988,144671
Subir un archivo de Microsoft office,Princippia Formaci贸n y Consultor铆a,https://youtube.com/watch?v=kffUkaxFmew,Google Drive,https://edutin.com/curso-de-drive-3988,3988,144669
Cambiar el aspecto a Google drive,Princippia Formaci贸n y Consultor铆a,https://youtube.com/watch?v=ktwQA7O7384,Google Drive,https://edutin.com/curso-de-drive-3988,3988,144688
Distribuir copias en drive,Princippia Formaci贸n y Consultor铆a,https://youtube.com/watch?v=lguMukRN80Y,Google Drive,https://edutin.com/curso-de-drive-3988,3988,144680
Recuperar un archivo o carpeta borrada,Princippia Formaci贸n y Consultor铆a,https://youtube.com/watch?v=LPTTem6UC_I,Google Drive,https://edutin.com/curso-de-drive-3988,3988,141483
Transferir la propiedad de un archivo,Princippia Formaci贸n y Consultor铆a,https://youtube.com/watch?v=m-bVYH0OSkU,Google Drive,https://edutin.com/curso-de-drive-3988,3988,141496
Configurar c贸mo compartir,Princippia Formaci贸n y Consultor铆a,https://youtube.com/watch?v=m9sysDv8q2k,Google Drive,https://edutin.com/curso-de-drive-3988,3988,141488
Crear una subcarpeta,Princippia Formaci贸n y Consultor铆a,https://youtube.com/watch?v=MG03oGtwt58,Google Drive,https://edutin.com/curso-de-drive-3988,3988,144650
Las cuatro preguntas para compartir,Princippia Formaci贸n y Consultor铆a,https://youtube.com/watch?v=Mj_Ewdp3pRw,Google Drive,https://edutin.com/curso-de-drive-3988,3988,144675
Activar las notificaciones en drive,Princippia Formaci贸n y Consultor铆a,https://youtube.com/watch?v=mjKFRy8F-V4,Google Drive,https://edutin.com/curso-de-drive-3988,3988,144679
Eliminar una carpeta,Princippia Formaci贸n y Consultor铆a,https://youtube.com/watch?v=n9vGF-NxkI4,Google Drive,https://edutin.com/curso-de-drive-3988,3988,144654
Configurar cu谩ndo compartir,Princippia Formaci贸n y Consultor铆a,https://youtube.com/watch?v=NBgwlq_DA-s,Google Drive,https://edutin.com/curso-de-drive-3988,3988,141489
Control de los archivos compartidos,Princippia Formaci贸n y Consultor铆a,https://youtube.com/watch?v=NLdhO17Vp-M,Google Drive,https://edutin.com/curso-de-drive-3988,3988,141494
Ejemplo de c贸mo compartir un archivo,Princippia Formaci贸n y Consultor铆a,https://youtube.com/watch?v=p5mO7mFyONY,Google Drive,https://edutin.com/curso-de-drive-3988,3988,141492
Ejemplo de c贸mo compartir un archivo p煤blicamente,Princippia Formaci贸n y Consultor铆a,https://youtube.com/watch?v=p5mO7mFyONY,Google Drive,https://edutin.com/curso-de-drive-3988,3988,144676
Crear una carpeta en Google drive,Princippia Formaci贸n y Consultor铆a,https://youtube.com/watch?v=PS3S7ca-VMc,Google Drive,https://edutin.com/curso-de-drive-3988,3988,144649
Utilizar Google keep para corregir el trabajo de tus alumnos,Princippia Formaci贸n y Consultor铆a,https://youtube.com/watch?v=RJuY8_IC7io,Google Drive,https://edutin.com/curso-de-drive-3988,3988,144689
Crear una copia de un archivo,Princippia Formaci贸n y Consultor铆a,https://youtube.com/watch?v=rTbYkEqdYYA,Google Drive,https://edutin.com/curso-de-drive-3988,3988,144672
Copiar carpetas en Google drive,Princippia Formaci贸n y Consultor铆a,https://youtube.com/watch?v=S-aQj6-waJU,Google Drive,https://edutin.com/curso-de-drive-3988,3988,144656
Eliminar un archivo o carpeta,Princippia Formaci贸n y Consultor铆a,https://youtube.com/watch?v=TguAWOgro60,Google Drive,https://edutin.com/curso-de-drive-3988,3988,144674
4 trucos de Google drive que no te puedes perder (2018),Princippia Formaci贸n y Consultor铆a,https://youtube.com/watch?v=tXK-lWl6dhA,Google Drive,https://edutin.com/curso-de-drive-3988,3988,144690
Operaciones b谩sicas con carpetas,Princippia Formaci贸n y Consultor铆a,https://youtube.com/watch?v=U_x30YN9Ikk,Google Drive,https://edutin.com/curso-de-drive-3988,3988,144647
Formato de texto,Princippia Formaci贸n y Consultor铆a,https://youtube.com/watch?v=u01GvB_-YOo,Google Drive,https://edutin.com/curso-de-drive-3988,3988,141506
Permisos especiales para editores,Princippia Formaci贸n y Consultor铆a,https://youtube.com/watch?v=y0JxRvoNzm4,Google Drive,https://edutin.com/curso-de-drive-3988,3988,141490
Herramienta de sincronizaci贸n pc,Princippia Formaci贸n y Consultor铆a,https://youtube.com/watch?v=yAsQbOtHcuA,Google Drive,https://edutin.com/curso-de-drive-3988,3988,144686
Temas de color,Print Me Some Color,https://youtube.com/watch?v=yTU7tuULMuc,Editor de Gr谩ficos Vectoriales con Adobe Illustrator,https://edutin.com/curso-de-illustrator-3738,3738,111262
Desarrollo de proyectos seg煤n enfoque PMI,Procem Consultores,https://youtube.com/watch?v=Og7iI31kwPQ,Diplomado en Microsoft Project,https://edutin.com/curso-de-project,1920,142584
Definici贸n de PMI,Procem Consultores,https://youtube.com/watch?v=Og7iI31kwPQ,Diplomado en Microsoft Project,https://edutin.com/curso-de-project,1920,142752
Concepto de Software,Prof Ronaldo,https://youtube.com/watch?v=bMdJ7gNgpyQ,Diplomado en Sistema Operativo Windows,https://edutin.com/curso-de-windows,3581,147178
Estructuras de Sistemas Operativos,Prof. Juan Carlos Osses V.,https://youtube.com/watch?v=lzWnmWqVjLo,Diplomado en Sistema Operativo Windows,https://edutin.com/curso-de-windows,3581,147195
Uso compartido y tecnolog铆a Storage Spaces,Profe Carlos Leal,https://youtube.com/watch?v=Mdi2MABn7Ts,Diplomado en Windows Server,https://edutin.com/curso-de-windows-server,4485,148269
Insertar audios y v铆deos,Profe Gauthier,https://youtube.com/watch?v=LrZ_ZYYT6TY,Google Drive,https://edutin.com/curso-de-drive-3988,3988,141532
Obtener plantillas de PowerPoint,Profe Online,https://youtube.com/watch?v=Ssd9_1aoQWI,Diplomado en Microsoft PowerPoint,https://edutin.com/curso-de-powerpoint,546,106252
Efecto de texto editable,Profeivan,https://youtube.com/watch?v=i_MJWny44Fc,Editor de Gr谩ficos Vectoriales con Adobe Illustrator,https://edutin.com/curso-de-illustrator-3738,3738,111288
Herramienta pluma,Profeivan,https://youtube.com/watch?v=i0b-RB0a-Uw,Editor de Gr谩ficos Vectoriales con Adobe Illustrator,https://edutin.com/curso-de-illustrator-3738,3738,111242
Combinaciones tipogr谩ficas,Profeivan,https://youtube.com/watch?v=OVDtXaPnZ0E,Editor de Gr谩ficos Vectoriales con Adobe Illustrator,https://edutin.com/curso-de-illustrator-3738,3738,111367
El 谩tomo,Profes App,https://youtube.com/watch?v=rMjmAraA9H0,Fundamentos en Ciencias de la Computaci贸n,https://edutin.com/curso-de-introduccion-a-la-computacion-4164,4164,92873
Escalar objetos,Profesor Carlos Figueroa,https://youtube.com/watch?v=2zyQTT1YSrQ,Editor de Gr谩ficos Vectoriales con Adobe Illustrator,https://edutin.com/curso-de-illustrator-3738,3738,111330
Iniciar o crear una presentaci贸n en PowerPoint,PROFESOR KUNZ,https://youtube.com/watch?v=Oj8G8OgUiRs,Diplomado en Microsoft PowerPoint,https://edutin.com/curso-de-powerpoint,546,106232
La foto de perfil y su cambio,"Programaci贸n F谩cil ,SEO y Marketing",https://youtube.com/watch?v=1hs_M5BfDbM,Diplomado en Microsoft Outlook,https://edutin.com/curso-de-outlook-1925,1925,141650
El cambio de n煤mero de tel茅fono,"Programaci贸n F谩cil ,SEO y Marketing",https://youtube.com/watch?v=705cMO7Jpqs,Diplomado en Microsoft Outlook,https://edutin.com/curso-de-outlook-1925,1925,141665
Configuraci贸n de respuestas autom谩ticas,"Programaci贸n F谩cil ,SEO y Marketing",https://youtube.com/watch?v=8j6fuiPIcO0,Diplomado en Microsoft Outlook,https://edutin.com/curso-de-outlook-1925,1925,141666
Eliminar mensajes en Outlook,"Programaci贸n F谩cil ,SEO y Marketing",https://youtube.com/watch?v=8RxVou6NXYw,Diplomado en Microsoft Outlook,https://edutin.com/curso-de-outlook-1925,1925,141648
El cambio del nombre en la cuenta,"Programaci贸n F谩cil ,SEO y Marketing",https://youtube.com/watch?v=aC3XWrka2Yc,Diplomado en Microsoft Outlook,https://edutin.com/curso-de-outlook-1925,1925,141651
Configuraci贸n del idioma,"Programaci贸n F谩cil ,SEO y Marketing",https://youtube.com/watch?v=Ai7HOlQ63Fs,Diplomado en Microsoft Outlook,https://edutin.com/curso-de-outlook-1925,1925,141644
Eliminar la cuenta,"Programaci贸n F谩cil ,SEO y Marketing",https://youtube.com/watch?v=bacVspIRugw,Diplomado en Microsoft Outlook,https://edutin.com/curso-de-outlook-1925,1925,141649
Importar contactos desde Gmail,"Programaci贸n F谩cil ,SEO y Marketing",https://youtube.com/watch?v=Cj-3NDhgkgQ,Diplomado en Microsoft Outlook,https://edutin.com/curso-de-outlook-1925,1925,141669
Enviar archivos adjuntos en Outlook,"Programaci贸n F谩cil ,SEO y Marketing",https://youtube.com/watch?v=CTnUZ_QTwBM,Diplomado en Microsoft Outlook,https://edutin.com/curso-de-outlook-1925,1925,141670
Cerrar sesi贸n en Outlook,"Programaci贸n F谩cil ,SEO y Marketing",https://youtube.com/watch?v=guWzi4AkZro,Diplomado en Microsoft Outlook,https://edutin.com/curso-de-outlook-1925,1925,141656
Interfaz del programa,"Programaci贸n F谩cil ,SEO y Marketing",https://youtube.com/watch?v=HJQzXXDmCCY,Diplomado en Microsoft Outlook,https://edutin.com/curso-de-outlook-1925,1925,141454
Creaci贸n de carpetas y registro de la informaci贸n,"Programaci贸n F谩cil ,SEO y Marketing",https://youtube.com/watch?v=HkoKgLCD-K8,Diplomado en Microsoft Outlook,https://edutin.com/curso-de-outlook-1925,1925,141664
Recuperar la contrase帽a del correo,"Programaci贸n F谩cil ,SEO y Marketing",https://youtube.com/watch?v=HRJDT-rP_4Q,Diplomado en Microsoft Outlook,https://edutin.com/curso-de-outlook-1925,1925,141654
Bloqueo de correos no deseados,"Programaci贸n F谩cil ,SEO y Marketing",https://youtube.com/watch?v=iwr9HiteunU,Diplomado en Microsoft Outlook,https://edutin.com/curso-de-outlook-1925,1925,141647
Envi贸 de correos pesados,"Programaci贸n F谩cil ,SEO y Marketing",https://youtube.com/watch?v=iz6lt_a2aCQ,Diplomado en Microsoft Outlook,https://edutin.com/curso-de-outlook-1925,1925,141675
Cambio del correo alternativo a Outlook,"Programaci贸n F谩cil ,SEO y Marketing",https://youtube.com/watch?v=KwxuOBYFbxU,Diplomado en Microsoft Outlook,https://edutin.com/curso-de-outlook-1925,1925,141653
Creaci贸n de firmas de correo,"Programaci贸n F谩cil ,SEO y Marketing",https://youtube.com/watch?v=L0ANCtCG9ys,Diplomado en Microsoft Outlook,https://edutin.com/curso-de-outlook-1925,1925,141662
Cambio de fecha de nacimiento,"Programaci贸n F谩cil ,SEO y Marketing",https://youtube.com/watch?v=Liue_aUCB7M,Diplomado en Microsoft Outlook,https://edutin.com/curso-de-outlook-1925,1925,141652
Copia de seguridad en Outlook,"Programaci贸n F谩cil ,SEO y Marketing",https://youtube.com/watch?v=nGp8owQLVMk,Diplomado en Microsoft Outlook,https://edutin.com/curso-de-outlook-1925,1925,141655
Programaci贸n del env铆o de correos,"Programaci贸n F谩cil ,SEO y Marketing",https://youtube.com/watch?v=oYzXiJPmpYg,Diplomado en Microsoft Outlook,https://edutin.com/curso-de-outlook-1925,1925,141673
Cancelar el envi贸 del correo,"Programaci贸n F谩cil ,SEO y Marketing",https://youtube.com/watch?v=PpxEsYmr3_o,Diplomado en Microsoft Outlook,https://edutin.com/curso-de-outlook-1925,1925,141645
Enviar correos con copia oculta,"Programaci贸n F谩cil ,SEO y Marketing",https://youtube.com/watch?v=QBS4GgwdqI4,Diplomado en Microsoft Outlook,https://edutin.com/curso-de-outlook-1925,1925,141672
Exportaci贸n e importaci贸n de contactos,"Programaci贸n F谩cil ,SEO y Marketing",https://youtube.com/watch?v=TnhCLZ_AY8c,Diplomado en Microsoft Outlook,https://edutin.com/curso-de-outlook-1925,1925,141685
Cambio de direcci贸n de correo,"Programaci贸n F谩cil ,SEO y Marketing",https://youtube.com/watch?v=TPhNCh-tbbo,Diplomado en Microsoft Outlook,https://edutin.com/curso-de-outlook-1925,1925,141668
Anexar videos o seminarios,"Programaci贸n F谩cil ,SEO y Marketing",https://youtube.com/watch?v=VfvmZH4JVKo,Diplomado en Microsoft Outlook,https://edutin.com/curso-de-outlook-1925,1925,141682
La contrase帽a y sus cambios en Outlook,"Programaci贸n F谩cil ,SEO y Marketing",https://youtube.com/watch?v=VhiZfKdNRq4,Diplomado en Microsoft Outlook,https://edutin.com/curso-de-outlook-1925,1925,141646
Reenv铆o de correos a otras cuentas,"Programaci贸n F谩cil ,SEO y Marketing",https://youtube.com/watch?v=VwHnURrfB7M,Diplomado en Microsoft Outlook,https://edutin.com/curso-de-outlook-1925,1925,141684
Crear una cuenta de correo Outlook,"Programaci贸n F谩cil ,SEO y Marketing",https://youtube.com/watch?v=VYl8EaQc5uc,Diplomado en Microsoft Outlook,https://edutin.com/curso-de-outlook-1925,1925,141638
Agregar contactos Outlook,"Programaci贸n F谩cil ,SEO y Marketing",https://youtube.com/watch?v=X_oGd3KJW80,Diplomado en Microsoft Outlook,https://edutin.com/curso-de-outlook-1925,1925,141683
Personalizaci贸n del programa,"Programaci贸n F谩cil ,SEO y Marketing",https://youtube.com/watch?v=yiMwtU08S1k,Diplomado en Microsoft Outlook,https://edutin.com/curso-de-outlook-1925,1925,141643
B煤squeda de correos,"Programaci贸n F谩cil ,SEO y Marketing",https://youtube.com/watch?v=YtoP2EscFvE,Diplomado en Microsoft Outlook,https://edutin.com/curso-de-outlook-1925,1925,141667
Creaci贸n de plantillas y correos m谩s personalizados,"Programaci贸n F谩cil ,SEO y Marketing",https://youtube.com/watch?v=z_XbCOvmFNc,Diplomado en Microsoft Outlook,https://edutin.com/curso-de-outlook-1925,1925,141671
Creaci贸n de reglas de Correo en Outlook,"Programaci贸n F谩cil ,SEO y Marketing",https://youtube.com/watch?v=zDOQADIK91g,Diplomado en Microsoft Outlook,https://edutin.com/curso-de-outlook-1925,1925,141661
Creaci贸n de marca personal o comercial,"Programaci贸n F谩cil ,SEO y Marketing",https://youtube.com/watch?v=zwj06n4yAlE,Diplomado en Microsoft Outlook,https://edutin.com/curso-de-outlook-1925,1925,141693
Hello World en Docker,Programador Novato,https://youtube.com/watch?v=2Uu0lk-7pdg,Docker Profesional,https://edutin.com/curso-de-docker-3986,3986,152218
Concepto de Dolibarr,Programador Novato,https://youtube.com/watch?v=NTPMRp1bL0U,Diplomado en CRM,https://edutin.com/curso-de-crm-2741,2741,145958
Caracter铆sticas de una imagen en Docker,Programador Novato,https://youtube.com/watch?v=woTRh_b5zxE,Docker Profesional,https://edutin.com/curso-de-docker-3986,3986,152153
Instalaci贸n de Dolibarr,Programador Novato,https://youtube.com/watch?v=yNA0SkSsQAU,Diplomado en CRM,https://edutin.com/curso-de-crm-2741,2741,107567
Estructuras de control,Programamos,https://youtube.com/watch?v=6c0XmQG_kHM,Desarrollador de Algoritmos,https://edutin.com/curso-de-programacion-c,4163,113592
Pruebas y depuraci贸n,Programamos,https://youtube.com/watch?v=8bwfpUaxHRY,Desarrollador de Algoritmos,https://edutin.com/curso-de-programacion-c,4163,113595
Apariencia,Programamos,https://youtube.com/watch?v=a-aDVxhKyJM,Desarrollador de Algoritmos,https://edutin.com/curso-de-programacion-c,4163,93478
Variables,Programamos,https://youtube.com/watch?v=AfeQxgJjZHM,Desarrollador de Algoritmos,https://edutin.com/curso-de-programacion-c,4163,113593
Moviendo objetos con la mano,Programamos,https://youtube.com/watch?v=aS51WREneFU,Desarrollador de Algoritmos,https://edutin.com/curso-de-programacion-c,4163,113602
Programando un Arkanoid I,Programamos,https://youtube.com/watch?v=AZ6j9h1lnj4,Desarrollador de Algoritmos,https://edutin.com/curso-de-programacion-c,4163,113603
ABP con Scratch,Programamos,https://youtube.com/watch?v=dpiAPeSsitU,Desarrollador de Algoritmos,https://edutin.com/curso-de-programacion-c,4163,113594
Haciendo uso del sensor de audio,Programamos,https://youtube.com/watch?v=K84NowQaids,Desarrollador de Algoritmos,https://edutin.com/curso-de-programacion-c,4163,113600
Conociendo la herramienta,Programamos,https://youtube.com/watch?v=LaJ_le67gEg,Desarrollador de Algoritmos,https://edutin.com/curso-de-programacion-c,4163,113588
